Diet_type,Recipe_name,Cuisine_type,Protein(g),Carbs(g),Fat(g)
2,"Red Potatoes with Olive, Feta, and Mint",12,50.1,156.78,113.96
2,Olive-Garlic Deviled Eggs,9,51.2,6.31,100.89
2,Roasted Chicken Souvlaki,12,137.05,4.98,43.18
2,Courgette & quinoa-stuffed peppers,12,89.99,359.55,50.55
2,Chicken & chorizo traybake,12,278.51,183.35,259.41
2,Gin Mare's Red Tonic,18,0.17,19.3,0.06
2,Deli pasta salad,0,77.67,269.73,40.34
2,"Flash-fried prawns with chilli, lemon & parsley",12,42.29,11.62,30.6
2,Lemon & parsley butter beans,0,58.54,184.62,21.07
2,Fig & Ricotta Toast,12,11.72,30.74,10.4
2,Baked Hummus,12,59.63,73.86,114.77
2,School of Tapas: Catalan cod brandada,9,75.66,6.74,405.28
2,Spice Route Chicken,12,264.82,80.26,249.16
2,Roasted Veggie & Hummus Pita Pockets,12,13.19,41.15,10.48
2,Deli couscous,12,85.79,357.52,114.03
2,Rosemary roast lamb chops,12,147.94,195.26,245.52
2,Endive and Fennel with Tarragon Avgolemono Sauce,12,21.32,43.53,24.99
2,Grilled Eggplant with Rosemary,0,7.14,42.74,41.91
2,Honey yogurt cheesecake,0,106.14,420.12,409.12
2,Grilled Fennel-Cumin Lamb Chops,8,83.69,3.61,196.71
2,Spanish rice & prawn one-pot,12,63.01,235.56,37.66
2,Tostones with Herbed Salt,12,5.0,115.96,433.39
2,Rosemary-Roasted Leg of Lamb,12,392.94,4.74,306.31
2,Rouille,16,3.67,20.16,41.82
2,Piedmontese peppers,12,46.08,59.35,88.77
2,Herbed lamb cutlets with roasted vegetables,7,135.21,68.9,217.87
2,Orange & Black Olive Salad,12,7.88,93.25,16.75
2,Salmon Steaks with White-Bean and Olive Saute,12,243.73,174.96,158.3
2,Olive-Topped Orange Slices,0,4.07,47.79,9.58
2,Italian-style chicken burger & chips,15,164.68,503.04,109.98
2,Vegan Bistro Lunch Box,0,8.25,28.23,8.52
2,Roasted pepper salad with capers & pine nuts,17,8.51,39.76,53.35
2,Cook the Book: Turkish Yogurt Soup with Mint,14,105.69,131.7,55.13
2,Garlic-Mint Yogurt Spread Recipe,0,12.97,11.85,8.16
2,Garlicky Escarole,9,38.37,116.47,15.47
2,"Aubergine, chilli & bacon pasta",9,75.33,300.22,104.05
2,Lamb Chops with Pistachio Sauce and Vegetable Saute,12,177.96,70.81,308.26
2,Lamb Chops with Asparagus and Farro,9,329.78,282.19,732.29
2,Panzanella (Tuscan tomato and bread salad),9,6.78,38.12,95.71
2,Cold Pudding with Bulgur Grain,2,49.03,116.12,148.69
2,The Corsican Cocktail Recipe,18,1.75,155.39,0.99
2,Roasted Red Pepper and Feta Dip,12,33.94,19.35,58.05
2,Spanikopi-taters,0,47.11,182.6,39.28
2,"Eggplant, Pepper and Feta-Stuffed Phyllo Boreks",12,41.25,170.46,236.04
2,Zucchini Babaghanouj,12,18.73,43.96,73.73
2,Pomegranate Martini Recipe,18,0.13,8.42,0.2
2,Baked Ham with Rosemary and Sweet Vermouth,0,450.55,176.05,315.42
2,Vegan Seafood Spelt Pasta,0,54.91,264.71,49.65
2,Lemony Orzo with Tuna,12,238.42,358.03,140.01
2,Eggplant Dip (Baba Ghanoush),14,29.02,110.85,79.73
2,Slow-Baked Salmon with Lemon and Thyme,15,325.06,11.85,233.29
2,Sardine beccafico,12,41.45,146.5,53.19
2,Crudités with Feta Pistachio Dip,12,51.97,44.78,128.17
2,Broccoli with Red Pepper Flakes and Toasted Garlic,2,13.32,25.55,10.61
2,"Tilapia with Arugula, Capers, and Tomatoes",0,48.26,7.99,18.59
2,Tuna with Warm Cucumber and Fennel Salad,12,171.33,62.31,88.67
2,Spicy Red-Pepper and Eggplant Confit,7,21.97,121.53,221.82
2,Classic Cookbooks: Elizabeth David's Ratatouille Recipe,7,24.77,141.96,38.07
2,Tomato and Cucumber Couscous,14,24.2,112.28,10.19
2,Mini Mezze Bento Box,12,15.02,35.93,17.64
2,Zucchini Tapenade,12,6.94,17.34,55.8
2,Black Olive Tapenade,7,8.37,14.68,92.56
2,Warm Quinoa Salad,13,73.78,249.0,37.79
2,Greek lamb & macaroni bake,12,264.91,358.69,202.33
2,Orzo & mozzarella salad,9,128.71,282.28,165.42
2,Baked Shrimp with Tomatoes and Feta,12,136.89,107.9,60.69
2,"Chicken with ham, spinach & pine nuts",2,530.63,75.37,212.81
2,"Mahimahi with Onion, Capers, and Lemon",12,129.0,19.34,80.39
2,Coney Island Skewered Shrimp,12,247.98,23.15,45.62
2,Spinach Tabbouleh,14,24.7,97.07,57.77
2,Garbanzo Bean Stew with Escarole,17,45.16,133.63,14.41
2,Greek Kale Salad with Quinoa & Chicken,12,63.71,48.83,49.45
2,"Zucchini, Lamb, and Summer Squash with Buttermilk Dill Marinade",0,148.79,57.98,132.77
2,Eggplant & Chickpea Baked Pasta,9,59.71,220.29,52.11
2,"Tomato, Onion, Black Olive, and Feta Fish Packets",12,132.3,22.39,74.82
2,Mini Lamb Burgers with Pineapple Salsa,15,124.59,154.6,157.35
2,Birds Eye® Greek Veggie & Hummus Wrap,12,147.3,594.51,227.82
2,White Bean Soup (Fassoulatha),0,114.77,335.39,32.6
2,Spanish meatball & butter bean stew,12,99.28,150.74,90.43
2,Radicchio and Haricot Vert Salad with Candied Walnuts,0,7.65,76.77,66.46
2,Orange and Cumin Leg of Lamb with Roasted Tomatoes and Garlic Recipe,12,607.03,109.27,489.93
2,Grilled Radicchio Salad with Gorgonzola and Balsamic Vinaigrette Recipe,12,28.47,18.27,87.46
2,Frozen Apricot Soufflé,7,34.52,256.36,177.34
2,Corn on the Cob with Mint-Feta Butter,12,74.2,304.9,103.62
2,White Bean Salad with Carrots and Tomatoes,16,51.11,151.17,43.07
2,Portobello “Pizza” Margherita,9,35.08,46.33,31.2
2,"Pan-Seared Rib-Eye Steaks with Goat Cheese, Caper and Sun-Dried Tomato Butter",0,140.37,3.65,176.65
2,"Radicchio with Pine Nuts, Currants, and Aged Balsamic",12,5.7,26.33,66.04
2,Roasted Vegetable and Prosciutto Lasagna with Alfredo Sauce,9,47.39,131.33,35.18
2,Raw Artichoke Salad with Mint and Feta Vinaigrette,12,60.95,186.23,85.08
2,Chickpea Spread,12,145.6,489.97,274.51
2,Tabbouleh With Edamame and Feta,12,59.57,180.26,41.17
2,Hake with stewed peppers,6,137.59,109.12,90.22
2,"Balsamic-Glazed Salmon with Spinach, Olives, and Golden Raisins",15,76.13,94.2,72.1
2,Panzanella,12,43.1,237.81,221.51
2,"Tabouli Salad with Cucumber, Tomato, Feta, and Olives",12,34.78,137.31,79.1
2,Tuna Salad,0,82.73,40.17,21.91
2,Roasted Fish Catalan,12,96.52,32.82,20.63
2,Grilled Peaches with Franklin's Teleme,12,30.57,69.51,46.1
2,Lemon and Mint Seafood Skewers with Tabbouleh,14,132.09,144.52,19.92
2,Easy Shrimp Skillet,12,63.81,178.34,52.16
2,Chicken with Cherry Tomato and Olive Topping,0,155.25,10.07,31.41
2,PointsPlus Bulgur Pilaf with Pistachios and Raisins,12,29.87,171.54,36.44
2,Greek Layer Dip,12,86.52,207.99,53.49
2,Niçoise toasts,7,50.13,177.58,60.1
2,Cat Cora's Olive Oil Chocolate Cake,0,72.74,336.95,148.19
2,Lentil Stew with Spinach and Potatoes,14,60.81,189.87,30.64
2,Skewered Greek Meatballs,12,176.19,29.61,218.5
2,Fava Beans and Orzo Salad,12,94.19,276.06,53.22
2,"Braised Chicken With Artichokes, Olives, and Lemon",12,241.76,159.0,214.7
2,Pan-Fried Tomatoes with a Cornmeal Crust,0,12.46,92.77,74.97
2,Spicy Brussels Sprouts with Fried Capers,9,36.59,89.88,76.79
2,Grilled Lamb Meatballs,14,84.91,25.57,138.48
2,Honey-Glazed Doughnuts with Raisins and Pine Nuts,0,55.5,750.0,46.32
2,"Onion, Pepper & Feta Quiche",12,60.01,160.48,149.63
2,Greek Vegetarian Stuffed Zucchini,12,32.34,92.2,39.11
2,Cook the Book: Pita Bread,12,44.66,319.61,58.39
2,Salmon with salsa verde,15,357.97,189.46,315.0
2,Moutabal,12,34.92,112.17,24.8
2,Sea bass & seafood Italian one-pot,0,163.9,50.07,45.18
2,Fattoush with Yogurt-Tahini Dressing,12,22.88,49.4,26.34
2,"Roasted Red Pepper, Spinach & Feta Penne Pasta",12,79.14,306.42,84.84
2,Grilled Chicken with Rustic Mustard Cream,0,154.38,6.93,54.97
2,Orzo Olive Salad,12,35.83,141.46,70.35
2,Moroccan Ratatouille,14,28.14,151.73,41.51
2,Vegetarian Mezze Lunch to Go,12,31.83,50.32,56.31
2,Tuna and Olive Salad Sandwich,12,132.98,167.73,110.4
2,Hamburger Imbottiti (Stuffed Hamburgers),0,146.05,23.09,175.75
2,Grilled Squid With Olive Oil and Lemon Recipe,12,71.04,15.83,20.36
2,Corn and Fregola with Grilled Halloumi Cheese,9,74.43,272.88,137.59
2,Greek Roasted Fish with Vegetables,12,146.81,132.48,117.38
2,Spiced Silverbeet and Pumpkin Hash,0,20.99,88.57,107.25
2,Greek Chicken Sheet Pan Dinner with Green Beans and Feta,12,247.52,176.44,55.68
2,Mykonos Pork Roast with Tzatziki Sauce,12,347.08,35.21,183.42
2,Salmon with Roasted Red Pepper Quinoa Salad,15,139.98,98.53,138.01
2,Greek Stuffed Portobello Mushrooms,12,17.61,26.48,54.76
2,Ratatouille,7,10.97,56.46,56.84
2,Cheesy Greek-Style Baked Quinoa,12,73.56,143.19,89.34
2,Branzino al Forno,9,431.11,70.42,122.31
2,"Zucchini Noodle ""Pasta"" Salad",1,111.27,362.9,123.01
2,Vegetable Saute,0,56.93,186.48,32.98
2,Lamb Chops with Mint Gremolata,0,65.75,11.65,218.95
2,Fresh ATHENOS® Salsa,13,41.67,55.89,91.17
2,Almond-Apricot Chicken with Mint Pesto,9,199.63,84.21,194.66
2,Greek Burgers with Herb-Feta Sauce,12,122.62,83.43,118.48
2,Lamb & Eggplant Ragu,9,63.04,198.15,41.35
2,Shepherd's Salad,0,14.98,32.93,40.38
2,Tomatoes Stuffed with Puréed Cauliflower and Feta,12,44.16,57.12,80.85
2,"Pork Roast Stuffed with Roasted Red Peppers, Feta, and Spinach",12,308.94,55.85,222.81
2,Pita Bread,14,89.23,583.51,83.38
2,North African Vegetable Stew with Poached Eggs,13,80.33,196.54,47.17
2,Slow-Cooked Lamb with Lemons & Pomegranate,12,193.76,128.33,232.77
2,Gluten-Free Greek Halva Recipe,12,36.4,550.77,134.86
2,Spanish Clam Soup,12,304.84,226.63,109.62
2,Wilted Dandelion Greens with Toasted Matzo Crumbles,6,10.35,122.36,55.72
2,Tilapia & Summer Vegetable Packets,12,97.34,33.28,25.89
2,Holly Clegg’s Eight Layered Greek Dip,12,30.48,67.11,49.64
2,Greek-Style Chicken Salad,12,68.33,42.72,122.26
2,DIY Amaretto Recipe,18,13.6,299.79,19.72
2,Pomegranate Molasses-Glazed Chicken and Carrots,0,117.65,112.5,141.64
2,Raw Artichoke Salad,12,17.84,92.7,136.41
2,"Warm black-eyed peas salad with collard greens, spinach, feta & sun-dried tomato",12,35.35,90.7,73.71
2,Lamb Chops with Moroccan Salad,14,193.58,121.61,339.61
2,"Cucumber, Tomato & Feta Salad",12,11.2,27.29,50.67
2,Greek Cauliflower Rice Bowls with Grilled Chicken,12,118.21,44.88,107.69
2,Herbed Lima Bean Hummus,12,42.95,140.33,73.51
2,Sun-Dried-Tomato Relish With Cayenne Toasts,0,85.58,194.56,170.81
2,Vegetarian Stuffed Grape Leaves,12,57.9,363.37,98.45
2,Turkish Meat Bread,14,59.02,186.01,62.86
2,ATHENOS Seven-Layer Dip,0,107.37,302.39,100.57
2,Hummus with Slow-Roasted Vegetables,12,59.16,153.47,119.03
2,"Baked Chicken Legs with Chickpeas, Olives, and Greens",12,290.36,192.97,380.9
2,Bistro Chicken-Pasta Salad,7,103.41,194.15,67.1
2,Orzo Salad with Chickpeas & Artichoke Hearts,12,43.47,137.98,24.82
2,Greek-Style Shrimp and Feta Tacos Recipe,12,112.06,150.51,98.17
2,Hazelnut Panna Cotta with Berry Compote,9,34.69,212.32,265.0
2,"Greek Turkey Burgers with Spinach, Feta & Tzatziki",12,120.5,84.5,76.57
2,Vegetarian casserole,7,41.67,149.77,19.93
2,"Marinated Olives with Lemon, Thyme & Rosemary",12,7.05,50.56,113.5
2,Marinated Chickpeas,12,65.86,202.86,47.13
2,Grilled Portabella Burgers with Pesto Mayo,0,80.69,141.91,103.0
2,Tomato Dolma with Roasted Eggplant (Köz Patlicanli Domates Dolmasi),14,107.48,149.43,123.96
2,Baby-Artichoke Sandwich,12,128.75,376.68,160.56
2,Pita Chip Nachos,13,134.26,154.66,68.87
2,Herb and Mustard-Crusted Rack of Lamb,12,101.96,21.02,232.49
2,Kale Salad with Preserved Lemon & Walnuts,12,16.94,29.43,97.55
2,Chickpea-Farro Salad,6,53.42,184.36,41.09
2,Mexican Roasted Corn Salad With Buttermilk Dressing,13,40.09,145.0,37.25
2,Sumac Hummus,12,29.36,76.22,66.49
2,Walnut-Date Torte,12,54.68,383.6,112.39
2,"Mussels with Tomatoes, Wine, and Anise",9,117.86,116.72,76.96
2,Sea bream with a courgette salad with fresh mint and rocket,12,179.26,66.72,234.79
2,Caramelized Onion and Sour Cream Spread,0,78.92,277.84,151.23
2,Braised Lamb Shanks & Eggplant,14,224.43,78.02,183.6
2,Rouget and Shrimp with Lemon Sauce,0,175.91,50.03,138.15
2,Bacon Baklava,12,163.49,823.99,554.46
2,Lemon-Avocado Spaghetti with Shrimp,12,111.44,379.01,53.54
2,"Stuffed Peppers, Tomatoes, and Mushrooms",9,71.26,254.86,101.36
2,Roman-Jewish Fried Artichokes (Carciofi alla Giudia) Recipe,12,46.41,159.23,235.33
2,Yogurt-Marinated Lamb Kebabs,14,91.02,277.49,64.45
2,Zaatar and Lemon Grilled Chicken,7,262.62,43.46,368.27
2,Tzatziki,12,50.78,68.75,32.66
2,Fish Niçoise,7,76.03,41.4,24.7
2,Greek Salad Chicken Pita,12,133.23,281.65,82.39
2,Tomato & Artichoke Gnocchi,12,65.29,296.05,47.01
2,Couscous-Stuffed Chicken,9,166.03,46.07,64.46
2,One-Pot Greek Pasta,12,138.67,512.17,98.42
2,Roasted Garlic and Olive Salsa Recipe,12,32.22,78.46,72.25
2,Warm Tuna Salad Niçoise,7,77.19,129.82,31.19
2,Acorn Squash Stuffed with Chard & White Beans,9,67.87,233.76,52.7
2,"Peppers Stuffed with Lamb, Feta, Couscous, and Black Olives",12,173.33,227.55,281.84
2,Mustard Aioli-Grilled Potatoes with Fines Herbes,0,25.75,206.27,91.42
2,Broiled Lamb Chops with Walnut and Mint Gremolata,0,178.2,14.66,343.4
2,Our paella,12,436.65,283.86,388.51
2,Cod Baked with Tomatoes and Feta,12,107.81,69.5,59.74
2,Tangy-Sweet Lemon Chicken,0,235.01,289.66,164.76
2,Whipped Salt-Cod Spread (Brandade de Morue) Recipe,12,297.98,79.44,304.11
2,Grilled Lamb and Pistachio Burgers,0,100.79,14.53,160.58
2,Fish Soup with Saffron and Fennel,12,329.4,106.49,93.1
2,Bacon Swiss Burgers with Tomato and Avocado,0,174.59,97.06,164.78
2,Orgeat Recipe,12,60.49,361.57,142.8
2,Provençal Baked Fish with Roasted Potatoes & Mushrooms,12,98.38,104.75,34.74
2,Roasted Kale and Eggplant Tapenade,12,18.29,68.88,30.22
2,"Chickpea, Chorizo & Spinach Soup",12,87.97,182.05,76.83
2,Skordalia Trio,12,31.51,144.29,90.4
2,Labneh Stuffed Grape Leaves Preserved in Oil,12,95.12,34.35,784.56
2,Acorn Squash Stuffed with Chard & White Beans for Two,7,34.18,115.22,27.23
2,Dinner Tonight: Red Snapper with Tomatoes and Olives Baked in Foil Recipe,0,73.25,19.56,35.43
2,Greek-Style Chicken Breasts,12,163.25,36.27,61.89
2,Spring Lamb with Grilled Baby Artichokes – Mr. Bean,12,247.58,224.63,259.78
2,"Skillet Cod with Bulgur, Zucchini, and Tomatoes",9,205.84,145.35,50.36
2,Eggs Baked Over a Spicy Vegetable Ragout,16,46.52,78.19,41.24
2,Instant Pot Chicken Breast,7,102.22,1.1,25.48
2,Baccalà in Zimino (Salted Cod with Greens),0,297.23,43.93,53.0
2,Chicken-Garbanzo Salad,12,97.63,143.47,37.37
2,Spicy Lamb Burgers with Grilled Eggplant,17,251.96,152.38,325.38
2,Spiced Braised Lamb with Carrots and Spinach,12,294.18,100.24,375.0
2,Cook the Book: Piedmontese Peppers,7,14.67,55.62,67.77
2,Greek Meatball Mezze Bowls,12,129.23,118.99,93.66
2,Dinner Tonight: Zucchini Galette,0,48.52,37.77,40.98
2,Vasilopita,7,103.98,798.0,274.18
2,Yellow Tomato Gazpacho,12,20.33,90.1,22.66
2,Lamb Meatballs With Dilled Carrots,12,143.68,100.92,181.74
2,Ratatouille & Tabouleh,7,30.7,197.55,113.49
2,Sweet Orange Couscous with Dried Fruit,12,18.2,288.56,1.71
2,Provençal Turkey Kebabs with Grilled Lemon,0,127.42,27.02,58.44
2,Whole-Grain Orzo & Grilled Vegetable Salad,12,82.67,149.58,128.16
2,Persian Spinach and Yogurt Dip (Borani Esfanaj),0,17.38,27.36,16.82
2,Sheet-Pan Chicken & Vegetables with Romesco Sauce,12,130.42,169.05,169.26
2,Shrimp Prepared in the Scampi Style,17,220.9,37.84,136.03
2,Slow-Cooker Turkish Lamb & Vegetable Stew,14,152.35,165.11,122.58
2,Grilled Merguez with Ratatouille,7,99.76,107.78,307.18
2,Fava Bean Salad with Mountain Ham and Mint,0,970.31,823.34,322.84
2,Golden Panko Latkes with Sour Cream and Chives,0,48.52,268.05,278.23
2,Roasted Black Sea Bass with Tomato and Olive Salad,7,103.41,42.09,97.54
2,Veal Meatballs with Braised Vegetables,9,113.91,113.69,164.46
2,Escabeche,12,218.54,308.96,147.28
2,Kimchi-Sesame Hummus,12,42.04,115.5,71.36
2,"Mussels with Spices, Ginger, Lemongrass and Coriander",12,111.01,63.06,49.44
2,Korean Hummus,12,101.15,309.08,67.03
2,Espinacas con Garbanzos/Spinach and Garbanzos,12,46.05,128.0,51.71
2,Quinoa Salad with Pistachios and Currants,12,43.09,209.08,59.17
2,Chicken in Garlic-Vinegar Sauce,7,181.1,69.02,141.49
2,Ouzo Poached Shrimp with Tomatoes and Corn Salad,12,66.88,66.05,73.57
2,Greek Salmon Salad,15,13.44,99.69,22.25
2,"Dinner Tonight: Orzo with Cherry Tomatoes, Capers, and Lemon Recipe",9,35.82,115.03,31.12
2,Cider Doughnuts with Maple-Tahini Glaze,0,39.26,347.85,83.29
2,"Falafel, Feta, and Tomato Salad",12,37.66,84.02,108.06
2,Seaside Salad,12,227.93,51.62,184.65
2,Southeast Asian Carrot Salad with Mint and Roasted Peanuts,17,22.49,54.43,46.33
2,Tunisian Leblebi,12,98.69,215.1,32.2
2,Stuffed Red Bell Peppers,14,127.0,151.18,150.93
2,"Whole Wheat Spaghetti Salad With Grilled Zucchini, Kalamata Olives, and Feta Recipe",12,102.41,387.6,126.97
2,Braised Leg of Lamb with Juniper,7,355.04,112.89,304.93
2,"Swordfish with Olives, Capers & Tomatoes over Polenta",9,100.42,85.94,51.15
2,Falafel Pizza,9,71.31,218.32,60.34
2,Spanakopita Grilled Cheese,12,44.64,80.82,70.43
2,Autumn Olive Medley,7,363.39,112.36,306.17
2,Greek Tomato and Cucumber Salad with Farro,12,43.63,168.35,66.91
2,Ancient Arabic Coffee Shows Guests You Think They’re Worth It,14,1.64,10.27,0.2
2,Lemon-Herb Salmon with Caponata & Farro,15,152.24,158.87,79.49
2,Fried Squid Po' Boy with Avocado and Black Chile Oil Recipe,0,99.63,192.2,220.65
2,Roasted Tomatoes and Sage Pesto,9,54.18,114.77,258.04
2,Sea Bass Crusted with Moroccan Spices,14,129.58,20.8,30.88
2,"Rustic Rosemary, Grape and Feta Galette with Caramelized Onions",12,38.36,154.91,79.92
2,Piled-High Greek Vegetable Pitas,12,51.34,172.22,41.36
2,Greek Chicken & Cucumber Pita Sandwiches with Yogurt Sauce,12,104.99,164.17,98.54
2,Honeyed Prawns & Polenta,9,96.31,318.46,47.83
2,Pâtes aux Cêpes (Tagliatelle with Porcini Mushrooms and Crème Fraîche) Recipe,7,71.92,389.19,57.18
2,Savory Lamb Shanks with Eggplant and Barley,0,377.68,241.99,275.44
2,Artichokes with Broad Beans and Almonds,12,63.55,128.47,254.0
2,"Salad with Kale, Snap Peas and Lemony Feta Dressing",12,35.42,78.76,93.12
2,Irish Pizza,9,110.38,202.45,185.25
2,Chickpea Salad with Cumin Vinaigrette Recipe,0,66.72,205.83,159.5
2,Scrambled Eggs with Goat Cheese and Aleppo Pepper,12,51.0,14.13,75.57
2,Za'atar-Crusted Chicken Schnitzel,4,255.46,81.7,166.3
2,Pita Panzanella Salad with Meatballs,9,158.84,149.37,128.05
2,Chicken Hash Recipe,7,145.1,112.03,134.68
2,Hamachi Carpaccio with Piquillo peppers and Grilled lemon,12,108.86,29.66,132.56
2,Linguine with Shellfish Sauce,9,398.42,444.69,118.77
2,Braised Chicken with Fennel and Dried Figs,7,218.73,156.01,193.1
2,Garlic Croutons with Eggplant and Roasted Pepper Spread Topped with Grilled Shrimp,12,43.83,78.64,72.47
2,Tabbouleh Tacos with Tahini-Garlic Dressing,12,97.53,371.53,54.73
2,Fennel Braised with Artichokes,12,28.54,114.37,58.47
2,Sweet Chile Pork over Cumin Beans and Cilantro Rice,13,407.45,881.0,145.87
2,Roasted Garlic Vegetable Soup,0,70.08,161.99,152.23
2,Spicy Shrimp Tortillitas with Mango Mayonnaise,12,84.45,218.71,191.1
2,Ripe's Radicchio Salad with Tahini Lemon Drizzle,12,18.08,62.76,102.97
2,Beef and Vegetable Shish Kebabs Recipe,14,168.59,57.28,183.82
2,Watermelon Feta Tomato Salad with Basil Vinaigrette,12,14.91,97.1,77.79
2,Eggplant Napoleon,12,66.6,308.96,526.89
2,Sheep's-Milk Yogurt Cheesecakes with Grilled Figs and Pistachios,0,30.45,202.73,138.23
2,Greek Grilled Salmon Kebabs with Tzatziki & Green Beans,12,141.41,99.83,114.17
2,Salmon and Potatoes Roasted on Fig Leaves with Fresh Fig Salad,15,175.17,163.48,189.39
2,"Salad of Limas, Green Beans, and Chickpeas with Lemon and Parsley",0,30.56,113.35,31.73
2,Dinner Tonight: Curried Pork Noodles Recipe,1,97.73,201.04,127.89
2,Lamb Dumplings with Cucumber Vinegar Dipping Sauce,5,128.29,324.19,135.9
2,Pulled Blackened Chicken with Toasted Couscous,0,216.24,210.88,260.79
2,Beef Stew,0,168.43,101.65,50.5
2,"Lamb Meatballs with Yogurt, Eggs, and Mint",0,265.8,228.03,337.78
2,"Cook the Book: Cumin Seed Roasted Cauliflower with Salted Yogurt, Mint, and Pomegranate Seeds",12,23.51,99.19,35.13
2,Provencal Seafood Pie,12,190.2,302.85,254.22
2,"Chicken, Sausage, and Red Pepper Paella",12,247.13,394.06,303.66
2,Monkfish and Clam Bourride,0,146.42,197.86,56.9
2,"Grilled Swordfish with Artichokes, Tomatoes, and Olives",12,192.6,54.69,196.83
2,"Sabich Sandwiches (Pitas With Eggplant, Eggs, Hummus, and Tahini) Recipe",12,89.55,241.62,359.36
2,Lamb Kofta With Pomegranate Glaze,0,55.89,62.62,46.94
2,Healthy & Delicious: Irio Recipe,0,38.49,221.18,3.83
2,"Meat, Bulgur, and Rice Dolmades",12,59.78,108.31,72.74
2,Cardoon Soup with Black Truffle Carpaccio Recipe,7,20.65,136.09,67.09
2,Must-Try Hummus and Tortilla Chips,12,55.11,194.3,53.91
2,Irish Soda Bread with Ancient Grains,0,62.34,282.4,54.59
2,Zuk’s Grilled Octopus Salad,16,287.5,138.38,174.66
2,Pork Chile Verde with Red Chile Salsa,13,294.51,207.31,334.53
2,"Slow-Cooker Pork Shoulder With Tomatoes, Fennel, and Pasta Recipe",9,502.47,659.32,429.03
2,Cook the Book: Harissa Ravioli,9,63.35,183.09,112.59
2,Cook the Book: Stuffed Baby Eggplants and Zucchini in Pomegranate Sauce,14,148.0,503.8,1004.58
2,Pasta with Saffron,12,74.99,263.03,102.01
2,Cooking from the Glossies: White Bean and Roasted Garlic Hummus Recipe,12,110.67,340.66,85.54
2,Butternut Squash Soup with Apple and Ginger,0,81.03,403.57,496.19
2,Lemony Chicken with Root Vegetables,12,191.64,220.82,212.79
2,Cook the Book: Middle Eastern Lamb Pizza,9,94.42,262.65,113.23
2,Easy Provençal Lamb,7,446.71,234.62,448.83
2,Dinner Recipe for Two: Duck Breast with Pomegranate-Citrus Glaze,7,66.43,23.5,14.25
2,Cook the Book: Al Halabi Style Kebabs with Potato Moutabel,14,155.62,177.35,250.51
2,Capers: What's Not to Love? Recipe,9,82.98,25.84,105.67
2,Herby Lamb and Turkey Meatballs,0,174.42,19.0,148.2
2,Chickpeas with Spinach,8,198.07,208.61,102.58
2,Meat Lite: Eggs Any Style Shaksouka Recipe,12,34.97,15.12,39.65
2,Sweet Potato Bisteeya,16,88.12,518.34,245.25
2,Cook the Book: Fried Halloumi Salad,1,40.3,66.18,121.73
2,Eat for Eight Bucks: Sardine Linguine with Sundried Tomatoes and Olives Recipe,0,73.02,276.1,85.51
2,Italian Mixed Seafood Soup,9,309.78,107.85,55.37
2,Recipe: Spiced Oven Fries with Garlic Spread,0,4.45,22.53,15.58
2,"Casserole of Lentils, Eggplant, and Mint",14,49.8,189.68,77.8
2,Red Snapper with Provencal Tomato Sauce,7,202.0,168.47,119.43
2,Egyptian Fried Fish Fillets,0,211.86,236.26,235.28
2,Chicken Souvlaki With Tzatziki Sauce and Greek Salad Recipe,12,288.73,236.89,176.56
2,Cook the Book: Pan-Roasted Striped Bass with Tunisian Chickpea Salad and Yogurt Sauce,0,236.43,225.35,203.05
2,Meatballs Braised with Kale,12,531.48,279.16,566.41
2,"Balsamic-Braised Pot Roast with Tomatoes, Lemons, Raisins, and Black Olive–Pine Nut Relish",0,280.68,268.31,211.91
2,Det Burgers,10,211.09,119.36,144.07
2,Poached Salt Cod with Vegetables and Garlic Mayonnaise,12,656.65,315.52,73.73
2,"Scooped: Rosemary, Olive Oil, and Pine Honey Ice Cream",12,35.31,176.89,213.81
2,Crabby Falafel 'Sliders' Recipe,0,161.34,442.12,189.36
2,Chicken Thighs Confit,12,226.06,20.76,1092.92
2,Meat Lite: Eggplant Lamb Lavash Wraps Recipe,0,119.73,253.72,95.35
2,"Braised Chicken with Saffron Onions, Italian Couscous, and Dates",9,442.1,603.47,503.79
2,The Secret Ingredient: Preserved Lemons Recipe,0,326.24,283.27,390.59
2,Mediterranean Dip,12,21.71,40.46,32.12
2,Mediterranean Dip,12,21.71,40.46,32.12
2,Mediterranean Pan Roasted Salmon,15,97.73,52.22,84.28
2,Mediterranean Olive Spread,12,2.2,5.02,11.12
2,Lamb with mediterranean couscous,12,186.2,214.33,118.24
2,"Hummus Pizza, Mediterranean Style",9,54.84,188.68,89.59
2,Mediterranean Antipasto Salad,12,64.98,63.17,110.36
2,Roasted Mediterranean Chick Pea’s recipes,12,14.51,51.09,15.81
2,Mediterranean Elote,12,16.26,70.2,21.02
2,Mediterranean Pasta,12,63.92,283.44,115.42
2,5 Ingredient Mediterranean Dip recipes,12,22.95,13.03,52.44
2,Mediterranean Hummus,12,36.11,111.87,52.67
2,Chunky Mediterranean Vegetable Soup Recipe,12,53.71,128.07,19.18
2,Mediterranean Feta and avo stack with balsamic tomatoes,12,49.4,169.6,62.28
2,Mediterranean Mussels With Lemon Basil & Shallot,12,120.08,118.34,48.7
2,Healthy Mediterranean Veggie Omelette recipes,7,17.82,10.57,19.72
2,Mediterranean Chicken Soup,12,133.84,83.83,32.43
2,Mediterranean Vegetable Chip Crusted Chicken,12,103.54,88.85,144.51
2,Mediterranean Stuffed Mushroom Appetizer recipes,12,15.59,28.52,36.19
2,3-Minute Mediterranean Vegetable Lasagne recipes,9,107.91,287.32,75.99
2,Creamy Mediterranean Chicken Pasta Primavera,9,156.4,254.11,60.3
2,Mediterranean Flatbread Sandwiches,12,36.69,156.32,46.86
2,Mediterranean Pasta Salad,12,98.06,392.51,122.25
2,Mediterranean White Bean Bruschetta,12,66.11,256.88,90.16
2,Mediterranean Chicken Salad,12,43.84,31.94,44.49
2,Easy Mediterranean Pot Roast,12,263.44,73.29,102.77
2,Mediterranean Chickpea Burger Phyllo Bites,12,127.39,473.44,96.86
2,Mediterranean Chicken Salad recipes,12,34.06,54.17,35.91
2,Sheet Pan Mediterranean Cod,12,88.21,40.02,12.85
2,Roasted Mediterranean vegetables with fetta and olives,12,37.88,106.66,56.81
2,Mediterranean Pasta Salad,12,98.06,392.51,122.25
2,Mediterranean Quinoa with Cashew Tzatziki,12,65.39,232.64,74.8
2,Mediterranean Pasta Salad,12,88.07,352.89,122.97
2,Alouette Crumbled Feta Mediterranean Caponata,12,37.35,64.48,107.8
2,Alouette Crumbled Feta Mediterranean Caponata Recipe,12,37.35,64.48,107.8
2,Mediterranean Grilled Chicken,12,78.2,12.18,44.72
2,Mediterranean Couscous with Steamed Beets and Microgreens,12,81.52,130.91,182.29
2,Sam's Mediterranean Rotini Pasta Salad,9,64.44,294.7,252.4
2,Mediterranean Chicken Lettuce Wrap Salad,12,96.62,37.84,74.64
2,Mediterranean Salad with Crispy Chickpeas,12,51.99,192.73,36.48
2,Mediterranean Stuffed Peppers Recipe,12,246.19,479.71,243.89
2,Seared Chicken Thighs with Mediterranean Orzo Salad recipes,12,301.35,303.15,79.53
2,Cheesy Chicken Mediterranean Pasta Bake recipes,12,222.04,249.55,218.59
2,Mediterranean mackerel and potato patties,12,104.59,301.23,68.45
2,Mediterranean Cauliflower White Bean Dip,12,54.04,158.03,72.18
2,Greek Chicken Roulade recipes,12,212.92,20.97,131.37
2,Provolone Tartare,12,58.89,7.65,83.83
2,Quick And Easy Grilled Potatoes (4 Pts),12,15.79,133.36,27.59
2,Mediterranean Tomato Stew with Braised Swo,12,175.75,78.91,115.15
2,Mediterranean Shrimp ‘n Couscous Salad recipes,12,160.22,230.34,93.64
2,Kalamata Basil Cream Cheese Spread,0,14.57,15.71,84.57
2,Mediterranean Pizza with Whole Wheat Crust,9,164.08,374.81,182.37
2,Il Panino Toscano,9,100.19,74.38,101.21
2,Almond Apricot Dips Recipe,2,13.63,100.74,49.17
2,Mediterranean Salad with Hummus and Fried Halloumi,12,85.27,189.55,257.96
