Diet_type,Recipe_name,Cuisine_type,Protein(g),Carbs(g),Fat(g)
1,Keto Fat Head Dough Pizza Recipe,9,124.29,29.7,168.16
1,Sara Louise's Keto Stuffed Peppers,9,65.89,89.94,142.27
1,5-Minute Creamy Keto Cucumber Salad,0,2.18,13.72,22.67
1,Keto Chicken and Bacon Lettuce Wraps,0,124.23,8.24,177.52
1,"Glazed Ham | Keto, No Added Sugar",0,570.28,162.39,297.48
1,40 Minute Fresh Keto Chili recipes,0,172.37,55.88,201.08
1,Keto Chicken a la King Recipe,0,210.23,44.42,276.8
1,Keto Mini Chocolate Donuts recipes,0,50.79,121.09,239.93
1,No Churn Keto Chocolate Ice Cream,9,43.03,160.97,245.96
1,Crispy Keto Fried Chicken recipes,0,115.83,20.78,209.13
1,LCHF Keto Coconut lemon vanilla custard,0,24.56,67.07,93.94
1,Keto Friendly Chocolate Fat Bombs recipes,7,7.93,7.57,139.89
1,Easy Keto Taco Salad Bowl for 2,13,47.46,31.33,100.33
1,Keto Open-Faced Chicken Cordon Bleu,7,188.45,29.82,194.79
1,Keto Beef and Broccoli Stir Fry,5,49.94,15.93,40.33
1,Mad Creations Keto Creamy Cauliflower Dauphinoise,12,52.59,41.65,251.4
1,Keto Fathead Pizza with Chorizo and Salsa,9,153.39,40.88,214.66
1,Easy Keto Lasagna Stuffed Portobellos - Lo,9,162.32,55.35,243.42
1,Keto Sweet Pecan Tuna Salad recipes,0,131.66,30.76,202.26
1,Egg-Free Gluten-Free Keto Wraps,0,4.17,126.79,18.82
1,Low-Carb Keto Salmon Curry Recipe,15,119.66,57.89,242.72
1,Spicy Seasoned Keto Zucchini Fries Recipe,16,31.24,114.41,19.94
1,Keto Mozzarella and Tomato Broiled Shrimp,9,99.78,20.24,87.74
1,Keto Mexican Rice with Chorizo recipes,13,79.12,65.39,138.15
1,Sara Louise's Keto Zucchini Soup,12,12.25,32.96,14.57
1,Healthy Keto No-Cook Bento Lunchbox,2,66.03,16.08,50.21
1,Keto Steak and Mushroom Soup Recipe,0,128.51,104.27,25.43
1,Keto Bacon Wrapped Chicken Tenders recipes,0,68.83,5.53,98.26
1,Lamb Meatballs with Mint Gremolata - Keto,15,175.9,21.94,276.35
1,Keto Taco Cups with Avocado Salsa,13,140.76,46.68,196.07
1,"Roasted Radishes (Paleo, Low Carb, Keto)",0,5.05,25.46,27.73
1,Keto Pulled Pork for the Slow Cooker,7,285.67,73.91,181.25
1,"Keto Cauliflower Casserole, The Perfect Sidedish",9,110.12,44.45,220.02
1,Keto Green Bean Skillet Pizza recipes,9,227.07,34.74,269.1
1,Low Carb Keto Coconut Cauliflower Rice,2,17.45,42.51,77.14
1,"Sausage, Zucchini, and Cauli Keto Risotto",9,82.19,47.82,150.11
1,Keto 3 Bean Salad - Low Carb,0,24.31,39.47,49.81
1,Vegan Keto-Friendly Thai Yellow Curry,17,72.13,329.13,173.05
1,Keto Chicken Thighs with Charred Lemon,9,131.04,20.47,154.99
1,Keto Low Carb Beef and Broccoli,12,55.94,29.11,42.98
1,Coconut Flour Chocolate Keto Mug Cake,2,17.36,31.7,36.4
1,Sara Louise's Keto Chicken Saltimbocca,9,250.23,41.75,93.5
1,Keto No Bake Orange Creamsicle Cheesecake,0,106.71,112.87,498.58
1,Keto Salmon in Foil Packets with Pesto,15,98.78,20.26,109.87
1,Vegan Keto Shortbread Pie Crust recipes,0,16.55,53.02,125.8
1,Almond Flour Fried Chicken (Keto-Friendly),0,128.8,116.32,307.62
1,New Recipe: Peanut Butter Keto Cups,0,46.36,88.44,296.04
1,Keto Raspberry No-Bake Cheesecake recipes,0,31.97,63.83,198.52
1,Keto Chicken Salad Stuffed Avocados recipes,12,41.52,92.24,171.62
1,Keto Beef and Broccoli Lo Mein,5,132.13,277.41,62.27
1,"Keto Roasted Eggplant, Lemon, and Caper Salad",12,8.39,48.51,55.71
1,Keto Salisbury Steak with Mushroom Gravy,2,226.77,46.16,146.65
1,Keto Spicy Mango Mojitos - Low Carb,18,1.81,28.3,0.81
1,Keto Chocolate Cake in a Mug recipes,2,12.53,14.74,36.95
1,Portobello Pizza Keto Stuffed Mushrooms Recipe,9,59.73,32.92,71.87
1,Keto Strawberry Coconut Chia Seed Pudding,2,6.51,18.23,25.06
1,Keto Slow Cooker Mexican Chicken Thighs,13,118.81,13.06,116.16
1,No Eggs! Keto Mini Pizzas recipes,9,32.18,37.9,17.21
1,Sara Louise's Keto Beef and Broccoli,2,112.87,62.46,50.88
1,Keto Pesto Shrimp Skewers - Low Carb,9,19.66,19.02,50.1
1,Keto Garlic Parm Buffalo Chicken Dip,0,102.57,17.28,179.68
1,Keto Mushroom and Bok Choy Stir-Fry,5,19.48,29.85,55.78
1,"Loaded Cauliflower (low carb, keto) recipes",2,49.5,30.1,109.97
1,Savory Keto Pie Crust recipes,2,60.68,38.08,99.19
1,Air Fryer Keto Garlic Cheese 'Bread',0,75.96,9.1,78.4
1,Keto Kebab Salad with Tahini Sauce,12,110.29,85.73,194.24
1,Keto Mushroom Wild Rice Pilaf recipes,12,69.75,79.3,121.41
1,Keto Pizza – Turkey Crust Meatza recipes,9,184.18,12.71,98.31
1,Keto Coconut Flour Sausage Balls recipes,0,161.85,79.83,276.87
1,Keto Mac and Cheese with Pulled Pork,0,163.68,38.99,177.36
1,Keto Pork Rind Puppy Chow recipes,0,51.9,75.76,181.53
1,"Southwest Turkey Meatballs (Paleo, Whole30 + Keto)",0,185.17,29.6,71.86
1,Air Fryer Keto Onion Rings Recipe,0,40.48,32.67,34.71
1,St. Louis Ribs - Keto Style! recipes,0,478.31,27.99,717.47
1,Keto Chicken and Cauliflower Rice Soup,0,324.98,105.18,323.29
1,Keto Twice Baked Cauliflower Casserole recipes,9,93.63,61.71,187.39
1,Sara Louise's Keto Speed Chili,0,172.88,76.16,257.67
1,Ultimate Keto Burger | The Bacon Smash Burger,0,82.93,10.5,176.6
1,Keto Spaghetti Squash Puttanesca - Low Carb,9,8.13,44.53,62.07
1,Low Carb Keto Mexican Pizza #ketolicious,9,104.0,144.34,186.68
1,"Mustard Sardines Salad Recipe [Paleo, Keto]",0,32.18,3.95,14.99
1,Keto Cottage Cheese and Dill Popovers,0,97.91,79.24,187.06
1,Creamy Keto Taco Soup with Ground Beef,13,114.4,72.09,218.99
1,"Simple Roasted Radishes (Paleo, Whole30 + Keto)",0,6.61,32.74,26.67
1,Keto Low-Carb Roasted Garlic Gnocchi,9,59.87,8.27,115.24
1,"Crustless Spinach, Mushroom, and Tomato Quiche (Keto)",7,54.28,32.5,151.42
1,Megan R keto lemon fat bombs,2,20.43,70.24,205.65
1,Crispy Keto Corned Beef & Radish Hash,16,93.65,8.96,64.49
1,Keto Butter Rum Blondies - Low Carb,0,63.39,138.63,234.16
1,Easy Keto Korean Beef with Cauli Rice,17,89.67,32.44,105.26
1,Keto Mushroom Spinach Stuffed Pork Loin,0,325.28,30.37,153.51
1,Instant Pot Keto Crack Chicken Recipe,7,315.49,8.65,311.39
1,Low Carb Biscuits Recipe (Keto Friendly),2,65.22,42.11,180.0
1,Sara Louise's Keto Cream Of ”Risotto”,9,18.06,40.33,103.34
1,Keto Apple Dijon Pork Chops Recipe,2,51.28,6.13,99.19
1,Keto Chocolate Peanut Butter Fatbombs recipes,9,5.91,75.3,169.73
1,Sara Louise's Keto Beef Stew,0,320.1,116.95,136.22
1,"Peach Pulled Pork (Whole30, Paleo, Keto)",0,276.4,58.43,230.98
1,"Raspberry Almond Chia Pudding | Keto, Vegan",2,34.91,37.2,21.84
1,Keto Low Carb Rosemary-garlic Croutons,0,45.96,61.58,160.76
1,"Chicken and Waffles | Keto, Gluten Free",12,281.57,261.91,512.6
1,Keto Single Serve Chocolate Lava Cake,0,12.25,54.31,30.22
1,Keto Pumpkin Pie Spice Latte recipes,0,6.91,16.88,83.05
1,Sara Louise's Keto Almond Lemon Macaroons,7,58.66,192.51,118.08
1,Keto Shredded Chicken - Mexican White Chilli,13,197.46,46.5,116.63
1,Keto Slow Cooker Braised Oxtails recipes,0,185.39,26.71,227.55
1,"Tuna Omelette - Low Carb, Keto, GF",7,54.44,10.68,46.53
1,Keto Mini Vanilla Cloud Cakes recipes,0,69.99,144.48,236.68
1,Keto Spaghetti Squash Primavera - Low Carb,9,33.92,34.2,67.44
1,Keto Dutch Baby with Chocolate and Macadamia,4,36.97,39.12,87.22
1,Easy Four Cheese Pesto Zoodles - Keto,9,139.89,240.56,195.19
1,One Minute Keto Chocolate Mug Cake,0,13.57,39.67,43.91
1,Pork & Egg Pie (Quiche) recipes,7,158.17,141.1,294.22
1,Keto Sushi Smoked Salmon Roll-Ups,15,51.57,14.8,64.0
1,Keto Chocolate Bacon Toffee Ice Cream,2,57.47,377.19,328.13
1,Keto Philly Cheese Steak Skillet Dinner,0,170.91,26.06,235.09
1,KETO BEEF SHIN WITH CREAMED BRUSSELS SPROU,16,108.95,2.93,32.08
1,Homemade Queso Dip {keto / low carb},3,113.94,18.23,217.03
1,Keto Sheet Pan Curried Chicken - SCKC,0,137.45,27.93,167.71
1,Keto Salted Chocolate Olive Oil Mousse,7,36.81,110.46,154.97
1,Italian Meatball Casserole {Keto/Low Carb},9,288.53,80.47,314.77
1,"Keto Creamy Spinach, Mushroom, and Tomato Risotto",9,11.46,27.52,84.72
1,Asian Inspired Keto Pork Chops recipes,5,150.08,16.64,65.35
1,Keto Strawberry Jello Salad - Low Carb,7,53.12,73.19,213.66
1,Keto Crock Pot Chocolate Cake recipes,0,67.87,92.06,253.91
1,90 SECOND KETO BREAD WITHOUT EGGY TASTE,0,19.7,7.74,38.36
1,5 Minute Keto Egg Drop Soup recipes,5,22.16,14.92,26.79
1,Keto FatHead Rolls (Almond Flour Free),17,136.14,88.31,173.2
1,Keto Pork and Veggie Cauliflower Fried Rice,5,133.39,42.64,74.11
1,Keto Matcha Crème Brûlée recipes,7,23.96,29.75,198.68
1,5-Ingredient Keto and Vegan Chocolate Almond Balls,0,49.36,85.59,132.62
1,Easy Keto Grilled Pork Chops Marinade,7,314.0,21.42,281.38
1,Keto Grilled Radish Skewers with Herb Butter,12,2.02,7.45,46.27
1,Keto Chipotle Red Pepper Cheese Dip,16,13.12,43.43,45.06
1,Moroccan Ketchup - Keto Spicy Tomato Dip,14,13.1,70.58,1.78
1,Tzatziki: Indian Style {Low Carb and Keto},12,29.68,29.92,10.49
1,Spicy Keto Deviled Eggs without Mayo,16,53.93,28.2,92.82
1,Low Carb Keto Green Bean Casserole,7,47.32,67.02,110.74
1,Keto Instant Pot Broccoli Cheese Soup,7,106.32,105.68,180.41
1,Keto Brown Butter Pecan Ice Cream,0,38.35,93.45,389.26
1,Keto Peanut Butter and Jelly Sandwiches recipes,7,18.51,9.35,32.54
1,Keto Grilled Lobster Tails with Creole Butter,0,114.36,5.29,97.18
1,Keto Asian Chicken Meatballs (Nut Free),17,172.75,18.9,82.14
1,Keto Chili Cheese Dog Casserole recipes,0,243.39,72.42,346.65
1,Keto Cheesy Beef taco skillet with Cauliflower,13,162.87,41.5,91.85
1,Sara Louise's Keto Roasted Red Peppers,9,13.56,82.23,30.98
1,Keto Stuffed Artichokes in the Instant Pot,12,74.08,94.95,145.35
1,Shamrock Cheesecake Bars,0,53.94,167.33,224.97
1,Low Carb Keto Chicken Parmesan Recipe,9,306.99,25.95,216.65
1,No-Carb Keto Chocolate Fudge - Ketogenic Dessert,7,12.44,36.18,143.93
1,"Instant Pot Meatloaf (Keto, Low Carb)",7,117.72,21.45,114.73
1,Mexican Mocha Chia Seed Pudding (Keto),2,35.62,90.72,63.23
1,Keto Key Lime Pie Fat Bombs,0,24.03,87.75,262.5
1,Baked Keto Chicken Wings - Sweet & Spicy,16,241.71,22.98,252.73
1,Easy Keto Ham and Cheese Rolls Recipe,7,119.77,16.59,120.99
1,SUGAR FREE KETO ALMOND CHOCOLATE FUDGE (Ma,9,7.55,1.49,126.42
1,Keto Broccoli & Cheese Soup {low carb},7,184.47,79.17,335.24
1,Delicious Bacon and Chive Keto Deviled Eggs,6,39.39,4.88,69.2
1,Keto Teriyaki Turkey Rice Bowl Recipe,10,100.37,52.69,64.77
1,Bacon Cups with Keema Beef {KETO FRIENDLY},2,151.07,19.05,293.68
1,Keto Lamb Shanks in the Instant Pot,14,173.98,21.25,169.66
1,Instant Pot Keto Mississippi Pot Roast,2,197.35,68.73,287.83
1,3 Ingredient Keto Peanut Butter Mug Cake,2,15.19,10.34,25.3
1,Sugar and dairy free keto Easter eggs,7,17.85,111.24,298.01
1,Keto Almond-Crusted Bacon and Tomato Quiche,7,150.09,58.33,420.32
1,Keto Jalapeno Popper Frittata – Low Carb,7,88.72,17.21,196.03
1,Buttered Brussels Sprouts recipes,0,125.95,93.59,266.94
1,The BEST Creamy Keto Skillet Eggs Recipe,0,70.86,7.98,100.93
1,Sara Louise’s Keto First Spanish Omelette,12,39.65,18.22,49.19
1,Easy Peanut Chicken Keto Stir Fry,5,156.27,56.12,210.47
1,Keto Mini Chicken Pot Pies recipes,0,329.1,126.32,581.0
1,"KETO FRIENDLY Cauilflower, bacon and pumpkin soup",0,35.14,46.36,97.42
1,Easy Bacon Cheeseburger Soup (Keto Friendl,9,129.5,33.88,262.29
1,One-Pot Keto Jambalaya with Cauliflower Rice,0,232.61,80.3,234.1
1,Okra In Spiced Yogurt {Keto Low Carb},8,53.04,55.6,60.83
1,Easy Keto Turkey Fried Rice Recipe,0,111.17,53.31,72.95
1,Keto Au Gratin Brussels Sprouts recipes,7,40.86,29.51,112.5
1,Low Carb Chicken and Broccoli (Keto-Friendly),2,86.82,112.26,153.23
1,Keto and Low Carb Hamburger Casserole Recipe,0,115.63,60.1,161.99
1,Sara Louise's Keto Smoked Holiday Turkey,0,1092.0,49.28,313.81
1,Pressure-Cooked Keto Butternut Squash Soup,0,25.81,234.3,77.69
1,Instant Pot Keto Smothered Pork Chops,7,128.37,11.05,161.84
1,Bacon Wrapped Cheese Sticks {keto/low carb},0,58.64,6.42,162.47
1,Keto satay chicken bowl with zoodle salad,17,93.75,80.88,189.76
1,Keto Peppermint Coffee Flavor Shots (Fat Bombs),2,0.24,0.95,386.46
1,"Crispy Chicken Thighs | Keto, Paleo, Whole 30",9,164.03,17.95,176.27
1,Tuna Egg Salad with Sour Cream (Keto),0,98.33,6.68,74.47
1,Easy Low-Carb Keto Broccoli Cheddar Soup,0,102.64,36.71,230.98
1,Keto Spicy Prawn Hand Rolls recipes,2,51.15,29.26,116.43
1,"Keto Buffalo Cauliflower Chorizo ""Mac""-N-Cheese",0,110.33,45.42,209.09
1,Instant Pot® Keto Chicken and Kale Stew,7,85.08,34.62,48.18
1,Keto Vanilla Pudding ( egg and starch free),2,24.38,19.47,96.01
1,Keto Jalapeño Popper Deviled Eggs recipes,13,37.05,3.73,63.0
1,Easy Instant Pot® Keto Crack Chicken,0,251.8,14.6,235.28
1,Sara Louise's Keto Cheesy Squash Casserole,9,67.87,165.33,251.08
1,Easy Keto Lava Cake-Singe Serve,0,10.18,25.42,29.31
1,Tex Mex Chicken Salad,13,82.05,57.0,85.93
1,KETO Mexican Melty Chicken Queso Casserole,0,341.59,41.72,253.56
1,Keto Spaghetti Squash with Bacon and Blue Cheese,9,28.81,31.47,81.97
1,Sara Louise's Keto Instant Chicken Soup,7,455.0,72.21,444.33
1,ULTIMATE KETO LOW CARB BACON CHEESE BURGER,0,23.41,10.49,70.25
1,Sara Louise's Keto Grilled Chicken Fantastics,0,115.87,29.67,154.88
1,"Air Fryer Cauliflower {Whole30, Paleo, Vegan, Keto}",0,8.73,29.85,5.77
1,Bacon Cabbage Chuck Roast Stew - Keto Makeover,0,338.74,43.32,399.95
1,Easy Keto Chicken Shawarma - Low Carb,14,197.21,22.43,169.76
1,Instant Pot Keto Spinach Artichoke Dip Recipe,12,124.2,51.8,296.81
1,Keto Diet: Cost Breakdowns of Popular Recipes,0,227.31,27.27,430.02
1,Crispy Keto Fried Chicken in the Air Fryer,5,166.09,124.39,158.29
1,"Spaghetti Squash Chow Mein | Keto, Paleo",9,239.49,58.31,65.29
1,BEST KETO ITALIAN RAGÚ aka BOLOGNES,9,113.22,28.98,68.25
1,Sara Louise's Keto Chicken Crack Slaw,0,136.49,53.8,144.39
1,Pull-Apart Keto Pizza Bread recipes,9,128.97,82.16,146.26
1,Vegetable beef soup keto friendly recipe,7,152.27,71.6,62.25
1,SUGAR FREE KETO NEW YORK BAKED CHEESECAKE,0,22.21,13.73,42.8
1,"Chicken Drumsticks - Keto, paleo and under an hour",0,291.07,17.53,148.15
1,Keto sausage egg casserole recipe (no heavy cream),0,109.7,11.65,134.41
1,Sara Louise's Keto Baked Cauliflower Florets,12,81.75,98.68,140.13
1,"Tres Leches Cake | Keto, Gluten Free",16,76.73,44.47,268.12
1,Keto Malaysian Curry Puffs / Karipap recipes,8,269.32,88.03,278.36
1,Keto Coconut Curry Chicken Tenders recipes,17,138.13,32.21,210.53
1,Keto Chicken Pot Pie - Low Carb,0,184.43,58.62,207.79
1,Keto Slow Cooker Brisket Chili Recipe,0,148.04,60.43,212.34
1,Keto Egg Recipe: Asiago Cheese Cloud Eggs,0,55.71,4.86,41.04
1,Keto Stuffed Peppers With Cauliflower Rice Recipe,12,88.5,49.93,106.59
1,Keto pork chops recipe for busy family,0,133.19,33.45,192.7
1,Sara Louise's Keto Lemon Zucchini Bread,0,35.96,137.03,60.51
1,Keto Tex-Mex Ground Beef Casserole,13,190.56,57.05,239.65
1,Keto Thai Chicken Flatbread Pizza recipes,17,255.67,97.13,359.99
1,Keto No Bake Noatmeal Fudge Bars recipes,0,145.02,207.35,507.65
1,Keto Eggplant Burgers Recipe (Chinese Qiezi He),5,55.52,40.04,53.65
1,Low Carb & Keto-friendly Baked Onion Rings,0,55.31,46.35,45.23
1,Pork chops keto recipe with asparagus and mushrooms,0,111.27,39.74,87.27
1,"Creamy Roasted Sesame Dressing (Paleo, Whole30, Keto)",12,3.3,13.24,57.69
1,Keto Cheesy Shrimp Soup Recipe LCHF recipes,0,224.31,46.31,271.65
1,"Keto Beef Tips with Mushrooms, Onions, and Gravy",7,96.76,19.16,63.61
1,Sara Louise's Keto Turkey Zucchini Burgers,0,101.03,19.67,95.98
1,Keto No Bake Pumpkin Pie Cheesecake recipes,0,41.06,49.82,206.62
1,Keto Strawberry Mousse Cake - Low Carb,7,160.15,189.37,612.58
1,Why Salmon The Best For Keto Diet — Steemit,15,53.17,5.94,34.58
1,Sara Louise's Keto Tunisian Spicy Tuna,16,261.41,43.76,114.79
1,Creamy Keto Cucumber Salad [5-Min Recipe],0,1.58,10.39,22.57
1,"Keto Salmon Curry Recipe [Paleo, Low-Carb]",15,100.2,30.96,104.15
1,"Carrot Cake Cheesecake | Keto, Instant Pot",0,59.9,122.72,232.24
1,Keto Vegan Roasted Garlic Smashed Cauliflower | Blog,0,12.97,33.4,44.15
1,Sara Louise's Keto Chicken Fried “Rice”,5,134.49,45.94,83.48
1,"Sausage Stuffed Portobello Mushrooms (Paleo, Whole30 + Keto)",9,157.17,63.84,229.46
1,Roasted Leeks with Eggs (Paleo and Keto-Friendly),7,24.25,58.84,242.0
1,Keto Adobo Air Fried Chicken Thighs Recipe,12,160.26,8.18,174.45
1,Easy Keto Thai Skillet Chicken recipes,17,118.1,70.22,178.22
1,Keto Sausage and Wild Cauliflower Rice Casserole,0,127.3,106.15,219.08
1,Keto French Fries - Low Carb Jicama Fries,0,4.9,48.95,55.11
1,Sara Louise's Keto Louisiana Chicken Gumbo,0,189.01,102.88,274.89
1,Keto Lemon-Garlic Chicken Thighs in the Air Fryer,12,128.65,11.21,155.67
1,Broccoli Cauliflower Soup,4,50.26,100.93,27.18
1,Instant Pot® Keto Pumpkin Soup with Sausage,0,60.47,72.4,107.03
1,Raw Vegan Keto Strawberry Crumble (sweetener-free),0,14.11,52.65,56.69
1,Sara Louise's Keto Vegetable Meat Loaf,0,253.14,86.4,94.61
1,Giant Stuffed 3 Cheese Meatballs | Keto recipes,0,180.13,12.63,134.44
1,Jalapeno And Cheddar Cauliflower Muffins - Keto Recipe,2,125.8,41.11,157.48
1,Dark Chocolate Espresso Paleo and Keto Mug Cake,7,16.95,58.01,70.58
1,"Whole30 + Paleo Frittata {Dairy-Free, GF, Keto}",9,52.67,21.36,49.83
1,Brown Butter Pecan Keto Ice Cream recipes,0,10.94,16.48,169.72
1,Easy Keto Low Carb Taco Soup Recipe,13,88.18,55.1,173.29
1,Sara Louise's Keto Beef Zucchini Lasagna,9,203.78,144.66,305.14
1,Low Carb Lemon Bar Recipe - Keto & Glu,0,52.28,59.98,273.09
1,Low Carb Keto Asiago Alfredo Brussels Sprouts,9,95.67,97.25,191.06
1,Easy Low Carb Keto Creamed Spinach Recipe,7,18.56,23.32,118.65
1,Keto Teriyaki Beef on a Stick - Low Carb,10,101.88,5.57,27.28
1,Keto Egg Roll in a Bowl [Recipe] recipes,9,96.71,72.16,111.75
1,Keto Coconut Flour Tortillas/ from primaledgehealth.com,13,15.17,7.84,36.47
1,Keto Carrot Cake with Cream Cheese Frosting,0,76.43,155.74,250.22
1,Keto Gluten-Free Almond Carrot Cake recipes,2,49.48,46.71,202.89
1,Keto Salmon and Creamy Turmeric Veggies recipes,15,156.7,68.03,160.89
1,[DRESSING INGREDIENTS MISSING] Keto Mediterranean Broccoli Salad,12,27.66,71.18,25.82
1,"Chinese Chicken and Broccoli | Keto, Low Calorie",5,232.64,63.01,46.03
1,Instant Pot Bacon Cheddar Egg Bites (KETO),7,93.03,10.26,162.68
1,Sara Louise's Keto Fat Bomb Lettuce Wraps,7,29.45,22.69,158.24
1,"Chinese Bamboo Salad Recipe [Paleo, AIP, Keto]",5,3.94,7.38,14.61
1,"Mini Bacon Wrapped Meatloaf (Paleo, Whole30, Keto)",0,108.19,19.83,220.57
1,Loaded Keto Potato Dip (Low Carb Friendly),2,12.8,10.69,82.27
1,Cajun Butter Steak Bites,0,134.33,16.43,171.92
1,The Best Keto Beef Stew Crockpot Recipe,16,229.55,90.35,76.82
1,Keto Chicken Broccoli Casserole with Cream Cheese,0,202.77,62.82,227.46
1,Cabbage Soup Recipe [Keto & Low Carb] recipes,14,176.06,97.47,184.35
1,"Whole30 Ground Beef Taco Meat (Keto, Paleo)",13,89.43,47.16,106.19
1,"Leftover Turkey Stir-fry (Paleo, Whole30 + Keto)",0,131.1,36.31,31.61
1,Keto Waffles Stuffed with Cream Cheese [Recipe] recipes,0,28.41,3.95,81.41
1,Keto Pumpkin Cheesecake with Almond Pecan Crust,0,114.22,141.2,294.77
1,"Mayo Free Deviled Eggs (Paleo, Whole30 + Keto)",9,766.99,41.29,287.59
1,Keto Chocolate Peanut Butter Mug Cake recipes,0,13.48,34.39,44.04
1,Pressure Cooker Keto Creamy Shrimp Scampi recipes,5,156.32,179.87,64.86
1,"Crispy Turnip Fries {Whole30, Paleo, Vegan, Keto}",0,2.93,26.02,29.02
1,"Creamy Asparagus Mash Recipe [Paleo, Keto, AIP]",12,5.21,12.02,13.93
1,Low Carb Sugar Free Keto Blueberry Muffins,0,92.13,110.8,264.5
1,Keto Broccoli Cottage cheese balls (Low carb),0,57.88,40.87,72.68
1,Keto Fried Chicken {Asiago & Parmesan Breading} recipes,0,295.13,8.26,159.48
1,Keto Air Fryer Salmon Cakes with Sriracha Mayo,15,106.95,10.4,128.73
1,Vegan Keto Spaghetti Squash (Happy Thanksgiving!) recipes,0,4.32,40.55,30.4
1,"Paleo Chicken Noodle Soup Recipe [AIP, Keto]",1,57.43,33.95,53.48
1,Southern Green Beans {Keto Friendly/Low Carb},0,19.77,76.72,45.05
1,"Keto Short Rib Ragu - Instant Pot, SCKC",7,219.27,47.01,566.84
1,"Low-Carb, Keto Cheeseburger Stuffed Peppers Recipe",0,106.98,76.95,106.47
1,"Flourless Pumpkin Mug Cake (Keto, Low Carb)",0,13.43,30.38,29.87
1,Keto Instant Pot® Soup (Low Carb),0,116.4,108.63,148.25
1,Low/Carb - Keto Friendly Cauliflower Crust Pizza,9,219.29,29.05,302.26
1,Simple Keto BBQ Pulled Chicken recipes,0,439.53,51.04,372.3
1,"Lemon Garlic Baked Shrimp Recipe [Paleo, Keto]",12,99.82,31.72,29.53
1,One-Pan Keto Chicken Breast with Vegetable Ragout,0,137.9,46.56,80.18
1,"Easy Low-Carb, Keto Spinach Dip Recipe",0,84.62,30.05,163.5
1,Easy Creamy Garlic Parmesan Keto Pork Chops,0,188.74,22.87,217.86
1,Mad Creations Keto Greek Garlic Lemon Marinade,12,2.66,19.09,109.09
1,"Low-Carb Almond Coconut Sandies (Keto, Gluten-Free)",0,33.79,44.65,183.53
1,Keto Chilli Chicken | Andhra Style Chicken Recipe,7,297.22,50.45,301.39
1,"Raspberry Arugula Salad Recipe [Paleo, Keto, AIP]",12,5.06,21.21,19.52
1,Aunt Rocky’s Crustless Quiche Lorraine (LCHF/Keto),7,71.79,35.12,138.53
1,Dairy-Free Keto and Vegan Chocolate Fat Bombs,0,34.63,48.42,184.27
1,Sara Louise's Keto Lemon Basil Roasted Chicken,12,348.25,20.35,322.36
1,"Homemade Ketchup Recipe | Sugar Free, Keto, and Paleo",0,8.27,42.17,1.08
1,Keto Turkey Meatballs with Sour Cream-Horseradish Dip,0,139.58,32.11,136.32
1,Sara Louise's Keto Lime Cilantro Grilled Chicken,12,113.65,12.88,221.16
1,White Chocolate Nut-Free Keto and Vegan Fat Bombs,0,0.0,0.45,218.0
1,Keto Diet Recipe - Bacon Wrapped Asparagus with Eggs,0,40.95,12.42,74.19
1,Low-Carb Keto Chicken “Noodle” Soup recipes,1,171.31,285.58,77.14
1,"Chicken Alfredo Spaghetti Squash Low-Carb, Keto",9,96.92,47.95,231.94
1,"Sesame Ginger Fish Cakes (Paleo, Whole30 + Keto)",17,99.21,50.6,44.65
1,Sara Louise's Keto Overnight Marinated Rosemary Chicken,0,142.56,10.1,171.38
1,"Paleo Kimchi Beef Stir-Fry (Whole30, Keto)",0,66.68,45.64,31.42
1,Keto Pumpkin Spice Haystack Cookies - Low Carb,0,21.43,49.02,245.96
1,Easiest Keto Meatza You’ll Ever Make! recipes,0,149.54,21.9,110.64
1,Green Buttered Eggs - Keto and Low Carb recipes,0,23.48,6.11,53.51
1,Easy Keto Shrimp Scampi - Low Carb & G,5,127.05,39.09,61.23
1,"Keto Shrimp Fried Rice [Grain-free, Paleo]",5,55.56,22.35,61.89
1,Instant Pot® Keto Crustless Spinach and Gouda Quiche,7,65.94,23.16,110.41
1,Keto Faux Sous Vide Egg Bites recipes,7,143.67,18.13,200.66
1,"Crockpot Chicken Enchilada Bowls (Paleo, Whole30 + Keto)",16,139.86,76.81,135.28
1,Keto Pecan-Crusted Pork Chops in the Air Fryer,0,184.97,22.69,183.99
1,"Caesar Turkey Burger Bowls (Paleo, Whole30 + Keto)",0,169.12,30.04,230.99
1,Aunt Rocky’s Keto Pumpkin Spice Latte (Sugar-Free),18,1.13,41.1,11.31
1,Quick and Easy Keto Sweet and Sour Sesame Chicken,5,77.35,14.08,103.7
1,Slow Cooker Keto Chicken Tikka Masala recipes,8,204.39,59.2,354.32
1,"Crispy Cauliflower Salad | Paleo, Keto, Low-carb",7,35.07,72.95,78.1
1,"Bacon Sausage and Zucchini Casserole (Paleo, Whole30 + Keto)",9,153.22,37.26,235.3
1,Air Fried Asparagus with Garlic and Parmesan | Keto Friendly,0,3.75,1.26,6.93
1,Keto Instant Pot Red Wine Pork Stew,7,109.86,35.36,164.8
1,"5-Min Prosciutto Avocado Fat Bomb Recipe [Paleo, Keto]",9,50.36,24.7,43.33
1,"Turkey Meatballs (Low-carb, Keto, Gluten-free)",0,231.23,17.2,298.63
1,Priya’s #Keto Chocolate and Peanut Butter Fingers recipes,0,28.94,131.03,133.98
1,Priya's Yummy Keto Yogurt Soup - Vegetarian Recipe,0,5.66,13.22,17.28
1,Keto Lo Mein - Low Carb & Gluten Free,5,74.91,92.07,55.57
1,"Low Carb Salmon Cakes (Keto, Grain Free)",15,656.95,13.25,501.19
1,Easy Keto Broccoli Slaw Recipe (Low Carb a,0,11.34,29.01,75.19
1,Sara louise's Keto Sweet Chicken And Jalapeno Slices,0,285.5,115.26,126.23
1,"Easy Keto Tuna Salad - Low Carb, Paleo, Wh",0,122.72,1.61,39.47
1,Keto Pork Chops al Pastor - Low Carb,9,108.02,12.96,151.9
1,Keto Grain-free Bacon and Shrimp Risotto recipes,9,34.81,20.43,18.95
1,"Roasted Radish Hash (AIP, Paleo, Keto, Low-FODMAP)",0,4.02,19.88,20.85
1,"Moo Goo Gai Pan | Keto, Gluten Free",5,242.32,149.7,68.24
1,Keto Low-Carb Creamy Garlic Shrimp Alfredo,9,114.37,32.89,177.04
1,Crock-Pot Beef Stew {Keto/Low Carb},0,159.54,77.39,69.35
1,Keto Nutty Chocolate Cups - Delicious Low Carb Snack,0,62.39,153.83,158.72
1,"Gluten Free, Keto Friendly, Low Carb, Pie crust",2,43.48,102.28,134.1
1,"Fish and Leek Saute Recipe [Paleo, AIP, Keto]",12,49.88,13.97,18.07
1,"Greek Chicken Burgers (Paleo, Whole30, Keto, AIP)",12,95.51,45.45,74.93
1,KETO LOW CARB GREEN THAI CHICKEN CURRY,17,211.52,246.0,397.35
1,"Paleo Egg Frittata Muffins Recipe [Keto, Dairy-Free]",0,48.87,17.02,57.69
1,Low Carb and Keto Chicken Alfredo Pasta Re,9,141.3,117.92,276.21
1,Sara Louise's Keto Korean Beef Zo Mein,9,220.23,57.19,115.84
1,Keto Smoky Chicken and Vegetable Sheet Pan Dinner,2,211.65,96.02,237.49
1,Instant pot or Foodi Keto Steak Rolls and Asparagus,7,194.45,33.01,170.3
1,"Crispy Air Fryer Pork Chops | Keto, Gluten Free",15,167.82,12.79,85.36
1,"Paleo Passion Fruit Side Salad Recipe [Keto, AIP]",9,2.05,7.75,11.34
1,Keto Low Carb Baked Crack Chicken Cups Recipe,0,313.07,12.35,114.87
1,"Strawberry Matcha Chia Pudding Recipe [Paleo, Keto, Vegan]",2,6.4,13.74,40.33
1,"Turkey and Summer Vegetable Soup (Paleo, Whole30 + Keto)",0,242.35,156.35,111.04
1,Keto low carb vanilla and Chocolate Fudgesicle #ketolicious,0,16.18,35.57,187.88
1,Sausage Cheese Balls – Low Carb / Keto Friendly Recipe,0,108.39,291.76,97.26
1,Sara Louise's Keto Thai Coconut Curry Soup,17,31.54,151.04,285.54
1,"Keto Cauliflower Hash Browns (Grain Free, Low Carb)",7,45.28,19.44,29.66
1,Keto Lime Pork Chops {Crock Pot Meals} recipes,0,342.17,18.79,96.14
1,Air Fryer Keto Low Carb Fried Chicken Recipe,0,235.37,21.22,126.31
1,The Best Keto Low Carb Vegetable Soup Recipe,0,77.09,187.62,56.07
1,Keto Fathead Pizza and Pigs in a Blanket (GAPS too!),9,125.05,28.72,160.02
1,"Raw Italian Cauliflower Salad Recipe [Paleo, Keto, AIP]",9,4.57,13.59,29.47
1,"Gluten Free, Keto Friendly, Low Carb, Pound Cake",7,120.27,368.37,341.92
1,"keto broccoli salad - Low Carb, Gluten-Free, Ketogenic",0,57.87,29.67,284.12
1,"Air Fryer Keto Fried Chicken | Paleo, Gluten Free",0,286.43,23.91,262.67
1,"Keto Cauliflower Pizza Crust | Thin, Crispy, Dairy Free",9,33.04,54.69,37.79
1,Keto Mongolian Beef | Instant Pot or Slow Cooker,1,209.09,30.18,107.41
1,Keto BBQ Chicken Pizza (Dairy Free Crust) recipes,9,118.21,93.01,118.82
1,Shan's Wilted Spinach Salad (Keto/Low carb friendly),0,13.16,17.92,12.79
1,Keto Eggs Benedict Casserole with Easy Hollandaise Sauce,7,216.64,76.64,396.84
