Diet_type,Recipe_name,Cuisine_type,Protein(g),Carbs(g),Fat(g)
3,Bone Broth From 'Nom Nom Paleo',0,5.22,1.29,3.2
3,"Paleo Effect Asian-Glazed Pork Sides, A Sweet & Crispy Appetizer",17,181.55,28.62,146.14
3,Paleo Pumpkin Pie,0,30.91,302.59,96.76
3,Strawberry Guacamole recipes,13,9.62,75.78,59.89
3,"Asian Cauliflower Fried ""Rice"" From 'Nom Nom Paleo'",5,39.84,54.08,71.55
3,Paleo Shrimp-Stuffed Mushrooms recipes,12,68.62,34.15,42.44
3,Paleo Pumpkin Pie recipes,0,30.03,275.88,97.68
3,Autoimmune Paleo Pesto,9,4.25,14.15,72.9
3,Baked Banana Chip Encrusted French Toast,7,152.88,1874.52,385.8
3,Vietnamese Pho Pressure Cooker (Noodle Soup),17,602.91,274.87,400.01
3,Paleo Collard Burrito,13,44.62,28.66,78.46
3,Paleo Chawanmushi (Savory Egg Custard) recipes,0,61.43,13.29,24.6
3,‘paleo' banana bread,0,46.69,192.54,156.48
3,Leftover Turkey Sandwich recipes,0,54.09,34.97,14.1
3,Paleo Pumpkin Waffles,0,51.24,89.63,78.38
3,Fudgy Paleo Brownies,7,64.29,263.65,176.36
3,Magic Wings recipes,0,320.76,28.36,252.82
3,Turkey Club Sandwich,0,46.92,39.94,19.6
3,Easy Paleo Meatloaf,0,185.99,47.82,260.64
3,Paleo Crepes,7,15.73,15.91,49.16
3,Chocolate Pecan Pie recipes,0,59.86,567.39,320.76
3,Simple Crab Salad recipes,0,82.1,4.75,20.24
3,Chocolate Pecan Pie,0,54.7,503.39,320.12
3,Asian Meatballs recipes,8,167.07,55.11,210.14
3,Blueberry French Toast Casserole,7,78.59,290.1,84.95
3,Paleo Spanish Rice,12,28.67,64.13,37.71
3,Whole30® Sriracha,17,12.16,85.78,2.91
3,Banana Cream Pie,0,17.85,215.69,304.25
3,Spicy Salmon Cucumber Bites recipes,15,49.84,17.2,75.62
3,Blueberry French Toast Casserole recipes,7,78.59,290.1,84.95
3,Paleo Honey Cake,6,87.32,258.25,259.21
3,Chocolate Pumpkin Pie recipes,4,44.05,429.69,162.78
3,Paleo Creamy Alfredo,0,16.48,32.46,91.36
3,Paleo Blini recipes,6,15.5,12.78,23.29
3,Paleo Tzimmes,11,16.11,236.88,3.86
3,Paleo Pumpkin Bars,0,39.73,169.01,117.95
3,Paleo Fruitcake,0,82.45,271.48,204.91
3,Paleo Chocolate Frosting,0,14.19,85.18,150.26
3,Paleo Crepes recipes,7,27.38,9.57,61.87
3,Paleo Peach Crisp,7,39.58,126.88,97.83
3,Paleo Pumpkin Bars,0,36.27,182.51,105.1
3,Paleo Honey Cake,0,87.32,258.25,259.24
3,Paleo Carrot Soup,0,27.17,116.73,125.14
3,Paleo Fruitcake recipes,0,85.97,271.68,207.57
3,Best Paleo Chili,0,193.11,83.93,227.24
3,Perfect Paleo Pizza,9,123.47,75.65,235.87
3,Grain-Free Cauliflower Fried Rice recipes,5,37.54,56.92,53.88
3,Paleo Chocolate Frosting recipes,0,7.27,112.19,269.91
3,Paleo Eggplant Lasagna,9,172.17,186.26,467.17
3,Paleo Pecan Tart Crust,0,20.15,24.96,111.99
3,Paleo Shepherd’s Pie,0,189.35,143.25,300.66
3,Paleo Pie Crust recipes,0,56.39,43.01,143.87
3,Paleo Mug Cake recipes,2,10.48,19.56,12.5
3,Paleo Flourless Chocolate Cake,0,83.82,384.27,324.34
3,Mini Paleo Egg Bites,0,118.36,6.54,61.57
3,Egg-Free Paleo Macaroons,7,9.91,99.09,110.51
3,Paleo Raw Chocolate Bites,0,46.07,261.6,147.5
3,Paleo Mushroom Soup recipes,7,60.19,112.58,52.61
3,Paleo Birthday Cake recipes,0,68.21,199.96,161.13
3,Paleo Avocado Tuna Salad,13,32.45,24.27,31.05
3,Paleo Honey Cake recipes,6,90.83,258.46,261.91
3,Paleo Pumpkin Bars recipes,0,49.0,412.09,116.03
3,Perfect Paleo Baked Salmon,15,161.95,1.17,160.83
3,Chocolate Mousse (Paleo! Keto!),7,20.23,126.01,153.36
3,Crab + Avocado Temaki recipes,3,88.79,32.66,55.58
3,Red Cabbage Slaw with Tangy Carrot Ginger Dressing recipes,0,9.65,42.63,83.92
3,Paleo Prosciutto Egg Cups,9,80.95,6.34,113.98
3,Paleo Chicken Adobo recipes,12,123.17,61.52,107.7
3,Cranberry Apple Stuffing,0,47.89,285.93,93.75
3,Paleo Dirty Rice recipes,3,26.68,80.75,35.37
3,Slow-Cooker Paleo Meatballs,6,145.6,102.25,144.33
3,Delicata Squash Stuffed with Spiced Meat and Tomatoes (serves 2) and a side of Sauteed Chard recipes,9,100.74,92.07,360.57
3,Paleo Pork Chili Verde,0,107.7,68.02,28.69
3,Paleo Steak and Egg Salad,0,65.19,17.09,69.97
3,Easy Paleo Beef with Broccoli,12,102.5,38.41,98.85
3,Paleo Party Pork Carnitas,13,268.92,128.88,334.28
3,Paleo Pecan Tart Crust recipes,0,21.03,25.01,112.66
3,Paleo Shepherd's Pie recipes,0,189.35,143.25,300.66
3,Paleo Vanilla Birthday Cake recipes,7,71.11,159.31,147.25
3,Egg-Free Paleo Macaroons recipes,7,10.16,105.7,110.51
3,Paleo Raw Chocolate Bites recipes,0,46.07,261.6,147.5
3,Perfect Paleo Pie Crust recipes,0,43.97,104.37,160.83
3,Practical Paleo: Mint Chip Truffles,0,3.76,23.94,80.65
3,Cindy's Paleo Harvest Chili,0,210.45,139.56,272.52
3,Instant Pot Paleo Pork Tenderloin,7,362.76,16.83,64.04
3,Paleo Pecan-Crusted Chicken | everydaypaleo.com,0,258.66,55.59,103.91
3,Entertain Meatloaf Style,0,197.94,70.1,110.07
3,Semi-Homemade Paleo Spaghetti And Meatballs,9,128.54,366.81,166.72
3,Easy Paleo Herb Gravy recipes,7,23.56,39.05,42.25
3,Homemade Mayo (Paleo and Whole30 Friendly!),9,2.81,1.11,112.61
3,Paleo and Vegan Pesto stuffed mushrooms,0,10.73,15.5,49.29
3,Paleo Un-Stuffed Cabbage Soup,9,141.27,55.82,198.73
3,Sweet Potato Chili (Paleo-Friendly!),0,98.56,191.3,176.93
3,Paleo Dirty Cauliflower ‘Rice’ Recipe,12,26.68,80.75,35.37
3,Spicy Paleo Pumpkin Muffins recipes,2,121.84,413.93,317.39
3,Paleo Cauliflower Bacon Fried Rice Recipe,5,28.76,50.01,48.09
3,Paleo Beef and Sweet Potato Stew,0,200.82,153.82,102.62
3,Paleo Comfort Foods’ Poached Pears recipes,7,9.82,214.27,3.04
3,Madras Chicken Salad recipes,12,150.18,41.36,123.75
3,Slow Cooker Cheater Pork Stew recipes,7,244.29,69.44,249.9
3,Strawberry Rhubarb Crisp - and it's paleo. recipes,0,32.24,250.87,139.25
3,Paleo Pasta Salad with Avocado Oil Vinaigrette,7,31.23,74.97,116.67
3,The Paleo Diet’s Salmon Caesar Salad Recipe,15,155.95,49.31,150.25
3,"Eggplant ""Ricotta"" Stacks From 'Nom Nom Paleo'",9,32.32,157.39,194.11
3,Southwest Cowboy Chili From 'Nom Nom Paleo',0,430.2,138.37,178.17
3,Swiss Paleo’s Homemade Italian & Chorizo Sausage,9,1273.61,83.34,1608.54
3,Paleo Doritos Toast Will Scratch Your Snack Itch,0,32.75,22.67,2.45
3,"Paleo Pumpkin, Coconut, & Maple Custard Cups recipes",0,36.0,142.79,107.74
3,Paleo Spaghetti Squash and Amped Up Meatballs,9,128.33,154.22,125.77
3,Swiss Paleo’s Bugs Bunny Hasenpfeffer Stew recipes,15,65.78,96.23,130.86
3,The Paleo Kitchen’s Honey Mustard Chicken Thighs recipes,7,152.56,53.59,205.36
3,Stupid Easy Paleo’s Kickin’ BBQ Shredded Chicken recipes,0,283.7,78.55,252.1
3,Paleo-Friendly Roasted Butternut Squash with Crispy Sage Leaves,15,6.45,66.8,42.58
3,Orange Sriracha Chicken recipes,17,104.17,82.97,64.82
3,Overnight Cherry Chia Seed Pudding – Paleo/Gluten Free/Vegan,0,12.77,112.92,56.84
3,Paleo Pumpkin Gingerbread Cake with Maple-Vanilla Frosting recipes,0,73.83,185.59,307.46
3,"Sweet Potato & Pork Thanksgiving Stuffing (Paleo, Gluten-Free) recipes",0,197.91,312.15,371.5
3,Paleo Comfort Food? Here’s A Creamy Shrimp Fra Diavolo recipes,9,102.47,51.64,54.82
3,"Instant Pot Buffalo Sweet Potato Soup {Vegan, Whole30, Paleo, Gluten-Free}",0,14.26,79.07,109.53
3,Dill Butternut Squash Fries,0,7.68,89.2,14.38
3,Crispy Sweet Potato Fries,16,4.4,56.19,28.84
3,Rosemary and Garlic Parsnip Mash,0,3.34,48.53,13.6
3,Four Layer Beef and Bacon Casserole,0,213.63,149.66,298.56
3,Boston Baked Beef,0,135.99,193.85,232.95
3,Nutella Brownie Truffles,7,12.21,151.95,98.75
3,Best Ever Bars,0,62.76,194.9,266.67
3,Salmon Cakes,15,86.31,11.17,66.45
3,Crockpot Italian Chicken and Peppers,9,86.07,84.94,43.04
3,Herbed Rack of Lamb,14,35.36,6.76,133.82
3,Moroccan Braised Chicken and Kale,14,283.65,89.99,306.29
3,Roasted Tomato Soup,9,39.32,88.7,50.97
3,Sweet Plantain Guacamole,16,19.18,134.0,138.71
3,Turkey Spaghetti Zoodles,0,122.69,96.81,51.15
3,Celery Leaf & Fennel Poached Salmon,15,32.41,17.25,24.49
3,Turkey Veggie Meatballs With Spaghetti Squash,0,122.78,147.94,51.84
3,Asian Sesame Chicken & Broccoli,5,107.67,31.95,70.25
3,Cauliflower Fried Rice,5,46.62,82.76,53.47
3,Khoresht Lubia Sabz (Persian Green Bean Stew),0,121.29,69.51,49.55
3,Cinnamon Chocolate Swirl Banana Bread,0,68.73,266.84,183.04
3,Easy Pan Gravy,2,0.32,6.54,11.65
3,Salsa Fresca estilo Siete,13,4.94,33.55,1.11
3,Ginger Snap Pumpkin Butter Cookie Sandwiches,0,97.78,239.78,356.65
3,Cauliflower Soup Drizzled with White Truffle Oil,7,41.9,64.07,37.95
3,Apple Pumpkin Soup,0,9.95,64.53,19.56
3,Easy Vegan Pad Thai Supreme,0,97.94,217.78,168.32
3,Beef Chorizo con Huevo estilo Siete,12,133.92,12.88,92.88
3,Angel Food Cake,0,55.09,283.94,5.02
3,Asian Chicken Salad,1,69.61,44.66,128.44
3,Roasted Beef Tenderloin,0,349.89,10.57,130.34
3,"Kale, Artichoke and Pecorino Salad",12,36.98,40.42,58.68
3,Spicy Thai Peanut Kelp Noodle Pad Thai,17,92.67,357.52,68.86
3,Almond Meal Encrusted Chicken Nuggets - REAL FOOD Healing Recipe from Mee Tracy McCormick,0,191.06,25.06,137.85
3,Artichoke Francaise,12,35.81,127.03,62.87
3,Braised Short Rib Bolognese,9,242.69,59.62,607.18
3,Maialino's Olive Oil Cake (Adapted by Becca Fox),0,72.45,479.49,468.3
3,Homemade Ravioli with Ricotta Cheese and Spinach Filling,9,118.65,300.0,107.45
3,Boneless Short Ribs on the BGE,7,392.64,12.51,472.92
3,Ribollita,9,66.67,180.22,111.67
3,Pear and Apple Coffeecake with Walnut Topping,2,68.86,309.13,384.74
3,Artichoke and Perfect Asparagus Salad with Lemony Herbed Vinaigrette,12,22.61,68.6,103.89
3,Indian Spiced Broccoli and Potato Hash,15,9.39,47.36,10.47
3,Vegan Dark Chocolate Coconut Tart,0,32.24,221.1,103.54
3,Pork and Charred Brussels Sprouts with Chile Lime Sauce,16,145.56,240.17,89.14
3,Apple Fennel Casserole with a Coconut-Turmeric Twist,9,5.6,46.5,18.34
3,Slow-Cooker 'Osso Buco' Stew,9,211.11,94.79,61.46
3,Vegan Coconut Cream Tart with White Peaches and Blueberries,0,39.45,285.88,109.49
3,Spiced Harvest Cake,2,65.92,455.58,158.29
3,Paleo MeeNut™ Butter Sandwich on Paleo Bread™,0,0.93,3.08,24.31
3,Low Carb Paleo Egg Wrap Recipe,0,16.71,28.5,15.85
3,Paleo Nutella Banana Ice Cream,0,7.86,186.18,30.1
3,Paleo Whole30 Pesto Chicken Salad,0,176.97,10.7,206.48
3,The Elvis Paleo Sandwich Recipe,0,18.72,68.14,54.08
3,Simple Paleo Reese’s Cups,0,69.56,157.94,257.36
3,Paleo Meatloaf recipes,0,216.95,203.73,178.18
3,Paleo Nacho Casserole,13,156.83,88.03,167.6
3,Simple Paleo Coleslaw Dressing,12,6.76,17.01,89.82
3,Paleo Bread Stuffing recipes,0,54.96,208.13,49.2
3,Paleo deviled egg recipe,7,32.74,3.08,69.22
3,Paleo Peppermint Bark,0,30.23,191.35,235.63
3,Paleo Chipotle Dipping Sauce,13,2.14,15.79,116.27
3,Paleo Wrap Carne Asada Recipe,13,159.24,75.82,62.53
3,Homemade Paleo Protein Bars,0,368.04,500.49,210.84
3,Paleo Tzatziki,12,2.82,17.07,13.93
3,Paleo Pecan Pie Bars recipes,0,105.25,594.23,700.42
3,Loaded Paleo Cauliflower Nachos recipes,13,52.93,75.7,131.7
3,Gluten-Free Paleo Meatloaf recipes,6,170.21,136.35,196.93
3,Paleo Broccoli Salad recipes,0,22.75,124.99,146.91
3,Healthy Paleo Marble Cake recipes,0,42.18,245.32,90.32
3,Paleo Deviled Eggs recipes,7,87.75,10.06,163.03
3,Paleo Meatball Sub,0,57.04,62.66,77.65
3,Paleo Egg Salad recipes,0,35.77,30.22,88.57
3,"Caramel Caffe Latte (paleo, GF, dairy-free) recipes",0,3.28,32.7,15.37
3,Smoky Paleo Deviled Eggs recipes,7,34.1,8.47,69.53
3,Paleo Barbecue Beef and Bacon recipes,0,114.04,148.84,128.75
3,Paleo Pad Thai with Zucchini Noodles,17,3.5,40.81,0.36
3,Paleo Sunbutter Cups recipes,7,0.1,32.29,27.63
3,Paleo Quiche Cups,7,59.38,43.71,82.41
3,Paleo Pecan Pie,0,41.28,497.12,285.89
3,Paleo Smoked Tuna Salad recipes,0,24.83,19.77,90.32
3,Paleo Lemon Mousse,7,17.82,77.84,84.12
3,Paleo Aioli Salad Dressing,12,0.53,2.32,44.57
3,Paleo Flourless Chocolate Cake recipes,0,80.48,404.46,410.21
3,Paleo Flourless Chocolate Cake,0,55.16,123.66,244.31
3,Paleo Chicken Salad with Dates & Walnuts {Whole30} recipes,12,97.63,88.59,98.0
3,Paleo Blackberry Muffins recipes,0,43.48,81.37,88.44
3,Paleo Crockpot Cashew Chicken recipes,9,165.31,78.63,220.89
3,Paleo Blackberry Instant Pot Cobbler,7,33.01,287.56,114.66
3,Paleo Banana Bread French Toast,7,21.23,203.11,42.55
3,Three-Ingredient Paleo Chocolate Truffles,7,23.43,183.78,200.78
3,Toasted Egg Fiesta Paleo Wrap (Ketogenic),0,13.92,32.74,26.53
3,Paleo Beef Stroganoff,6,215.13,36.63,68.05
3,Paleo Whole30 Classic Egg Salad recipes,0,61.5,8.58,184.92
3,Easy Paleo Meatloaf with Bacon,0,203.61,23.57,166.41
3,"Gluten Free Beef and Tomato {Chinese Style, Paleo Option} recipes",5,107.83,56.13,81.39
3,"Buffalo Ranch Chicken Salad Recipe {Paleo, Whole30 Compliant} recipes",0,145.57,27.22,152.88
3,Paleo Crock Pot Pulled Pork recipes,0,255.11,99.29,170.32
3,Papaya Chicken Paleo Wrap,2,40.75,33.63,35.28
3,Paleo Vegan Enchilada Casserole,0,96.62,331.56,21.46
3,"Blueberry Almond Mug Cake (Paleo, Gluten Free)",0,14.22,33.55,34.47
3,Paleo Bang Bang Shrimp recipes,10,91.88,3.34,163.16
3,"Creamy Roasted Sesame Dressing (Paleo, Whole30, Keto)",12,3.3,13.24,57.69
3,Paleo Ranch Dressing and Dip recipes,0,1.77,5.8,190.1
3,Smoked Salmon Paleo Wrap Bites,15,34.01,82.25,27.63
3,Paleo Meatloaf,0,283.04,85.83,108.96
3,Dairy-free Paleo Ranch Dressing,0,5.63,10.85,226.21
3,Paleo Banana Chip Muffins recipes,0,95.83,139.93,188.95
3,Creamy (yet Paleo) Cucumber Salad recipes,0,3.23,17.66,45.05
3,Bunless Paleo Chicken BLTs recipes,0,97.48,19.3,119.43
3,"Frittata with Sweet Potato, Sausage and Caramelized Onions (Paleo, Grain-Free) recipes",9,126.61,109.21,188.1
3,Paleo Tangy BBQ Pulled Pork,0,244.91,263.45,61.97
3,Paleo Crab Cakes recipes,7,97.65,19.1,76.38
3,Simple Paleo Coleslaw recipes,12,14.52,80.91,90.39
3,"3 Ingredient Chocolate Walnut Fudge (Paleo, Vegan, Gluten Free, Dairy-Free)",0,48.8,126.11,160.21
3,Paleo Whole30 Chicken Salad recipes,0,171.35,54.47,285.53
3,Flourless Chocolate Peppermint Cake (Paleo and Low Carb) recipes,0,45.19,255.14,114.31
3,Easy Paleo Fried Fish Sticks,7,106.13,43.27,214.62
3,Paleo Cheese-Stuffed Meatballs,0,103.97,82.66,131.02
3,"Paleo Shrimp, Bacon and Tomato Pasta Recip",9,72.33,48.97,74.65
3,Primal Organic Chicken Recipe In A Paleo Wrap,0,37.07,50.05,35.2
3,Paleo Vegan Cherry Garcia Ice Cream,0,16.51,257.72,52.79
3,Paleo Peach-Blueberry Cobbler recipes,0,42.38,245.47,161.24
3,Paleo Sweet Potato Casserole,9,38.03,1061.56,199.18
3,Paleo Crab Cakes,0,32.3,14.14,106.85
3,Cinnamon Raisin Paleo Bread Pudding recipes,2,74.2,336.36,139.83
3,Paleo Chicken Piccata,7,38.49,111.57,127.66
3,Paleo Barbecue Chicken Casserole recipes,9,271.64,258.95,282.4
3,Baked Ranch Chicken Tenders (Paleo + Whole30),0,105.57,129.65,146.59
3,Chocolate Almond Buttercream Cups | PALEO,0,27.72,280.99,138.5
3,Paleo Broccoli Salad,0,33.1,59.46,126.68
3,Paleo Whole 30 Berry Chicken Salad,0,228.65,25.01,238.62
3,"Cauliflower Fried ""Rice"" (Paleo)",5,26.48,44.85,16.65
3,Paleo Pumpkin Bolognese,9,83.7,41.66,96.89
3,Paleo Egg Nog Cake recipes,2,62.83,159.42,66.35
3,Easy Paleo Reese's™ Cups,7,61.73,259.06,224.92
3,Paleo Cornbread Stuffing recipes,0,129.28,693.44,243.17
3,Sloppy Joe's - Paleo & Whole30 recipes,7,94.68,90.81,85.8
3,No-Bake Paleo Chocolate Chip Coconut Bars,0,74.81,272.62,518.78
3,Portobello Mushroom Paleo Taco,9,81.07,46.84,114.72
3,Paleo BBQ Ranch Meatloaf,0,173.86,79.71,130.88
3,Keto Paleo Tuna Taquitos Recipe,13,46.45,79.45,75.1
3,Paleo Chocolate Coconut Milk Panna Cotta,9,23.39,101.95,147.65
3,"Slow Cooker Honey Peach Chipotle Meatballs (Gluten Free, Paleo) recipes",6,23.44,256.29,25.75
3,Paleo Roasted Cabbage with Mustard Seed Dressing recipes,12,4.18,14.45,50.79
3,Paleo Tuna Spinach Casserole recipes,9,84.76,50.54,92.11
3,Paleo Beef Stroganoff,6,130.93,70.55,203.75
3,Slammin Wild Salmon Paleo Wrap Tumeric,15,95.18,45.51,55.22
3,Vietnamese Spring Rolls (Paleo) recipes,17,38.7,122.93,71.13
3,Paleo Banana Muffins recipes,0,52.77,99.46,150.99
3,Paleo Chicken Shawarma recipes,14,114.46,52.87,92.38
3,Paleo Spinach Donuts recipes,0,43.22,247.39,124.45
3,Paleo Strawberry Pie recipes,0,60.38,223.26,160.19
3,Quick and Easy Paleo Salads,7,44.68,28.95,73.11
3,Chocolate Custard (Paleo or Low Carb) recipes,7,36.84,126.43,159.07
3,"Pumpkin Milkshake (Dairy-free, Paleo, AIP) recipes",0,21.77,88.19,168.04
3,"Pistachio Crumbed Mushrooms (Paleo, Low Carb) recipes",2,47.75,59.33,157.69
3,"Paleo Chocolate Mousse Cake (dairy Free, Raw Dessert, Keto, Paleo, Gluten Free) recipes",0,48.81,278.15,264.65
3,Paleo Ground Beef Spaghetti Squash Skillet,9,96.21,128.43,115.48
3,Paleo Fried Green Tomatoes recipes,7,49.16,59.39,182.49
3,Dulce de Leche Ice Cream (Paleo) recipes,9,14.38,177.86,141.1
3,"Easy BBQ Jackfruit Saute Recipe [Paleo, Vegan]",0,2.02,108.4,14.76
3,"Easy 10 Minute Asian Zucchini Noodles (low-carb, Paleo) recipes",1,13.86,37.92,7.02
3,Paleo Maple Pecan Latte Mug Cake,0,12.5,36.44,32.19
3,Paleo Beef Stew,0,208.63,137.91,54.39
3,A No Bake Paleo Chocolate Cashew Coconut Dessert That’s Healthy,0,27.93,87.43,751.19
3,"Easy Chicken Herb Salad (Paleo, Low Carb) recipes",0,81.02,9.13,109.01
3,Frozen Chocolate Custard (Low Carb and Paleo Friendly),0,40.47,56.32,184.95
3,Paleo Ground Beef Spaghetti Squash Skillet recipes,9,96.21,128.43,115.48
3,Salted Caramel Bliss Balls- Aka Paleo Style Truffles,7,58.09,221.62,168.29
3,20-Minute Paleo Cashew Chicken,0,189.22,139.79,190.27
3,"Healthy Buffalo Turkey Meatballs (paleo, GF) recipes",0,107.96,14.59,67.22
3,"Shepherd’s Pie with Cauliflower Topping (GAPS, Paleo, Grain-Free) recipes",0,110.14,57.66,168.1
3,Paleo Chocolate and Candied Orange Peel Freezer Fudge (GF) recipes,0,60.59,289.03,220.89
3,Paleo Crockpot BBQ Pulled Pork,0,403.14,254.68,412.96
3,Primal Roast Beast Wrap Recipe,2,65.76,53.13,62.59
3,Paleo Chili Over Zero Carb Paleo Miracle Rice™,0,184.44,249.2,24.04
3,Saucy Grilled Paleo Pork Chops Recipe,6,77.12,79.94,29.49
3,"Orange and Five-Spice Roasted Chicken Legs | Keto, Paleo",12,677.22,41.71,686.9
3,The Best Paleo Beef Enchiladas recipes,13,116.96,182.48,163.36
3,Paleo Chicken Taco Meatballs (GF) recipes,13,90.61,10.48,51.89
3,Smoky BBQ Paleo Chili recipes,0,97.93,107.81,116.11
3,Collard Green Paleo Slaw (Super Slaw) recipes,12,5.4,28.18,31.71
3,"Blueberry Chia Seed Coleslaw (Paleo, GF) recipes",0,12.01,80.23,53.09
3,"Orange Chicken Recipe (Paleo, Grain-Free) recipes",7,191.91,161.86,143.79
3,Sneaky Chocolate Veggie Cake (Paleo option) recipes,0,96.82,335.74,291.09
3,Paleo Cauliflower Fried Rice,5,56.99,97.39,56.34
3,Caramel Chocolate Mousse (Paleo & Vegan) recipes,0,38.1,270.02,232.58
3,"Healthy Fudge Bites {Paleo, Gluten Free, Sugar Free, Dairy Free} recipes",0,8.38,178.34,297.71
3,"Easy Crab Cakes (Paleo, Low Carb) recipes",7,94.1,15.58,63.84
3,Keto Paleo Meatloaf recipes,0,143.36,37.65,172.61
3,Paleo Ginger Cake with Lemon and Coconut,7,59.12,86.59,200.92
3,Paleo Whole30 Classic Potato Salad,12,32.03,272.41,57.65
3,Paleo Chocolate Pistachio Biscotti recipes,9,53.41,214.31,129.8
3,Paleo Sloppy Joes with Sweet Potatoes recipes,0,90.72,202.74,106.32
3,Gluten Free “Carrot Cake” Vegan Cheesecake {Paleo} recipes,0,74.18,426.76,307.56
3,Paleo Chocolate Chunk Banana Bread recipes,0,81.41,257.6,233.5
3,Paleo Sweet and Sour Pork,12,97.79,167.44,112.53
3,"Egg Salad Lettuce Wraps (Paleo, GF) recipes",0,31.06,10.09,50.9
3,"Spaghetti Squash Soup with Pumpkin and Fall Flavors {GF, Vegan, Paleo}",0,42.79,175.5,44.84
3,"BBQ Beef Pizza (AIP, Paleo)",9,111.23,259.49,110.34
3,Paleo-Approved Classic Chicken Salad,0,37.0,58.18,212.82
3,Primal Curried Egg Salad Coconut Wraps,0,22.37,38.14,42.75
3,Baked Salmon with Pesto and Pecans,15,329.12,8.78,251.78
3,Paleo Banana Chocolate Chip Muffins,0,105.65,526.6,219.56
3,"Almond Flour Crust for Tarts or Pies - Gluten Free, Low Carb, Sugar Free, Paleo recipes",0,62.5,84.87,199.1
3,"Spatchcock Herbed Chicken (Paleo, Whole30 option)",7,226.67,21.54,221.69
3,Paleo Chocolate Sweet Potato Bread (gluten and dairy free),0,77.32,1801.16,887.91
3,Easy Paleo Lemon Chia Seed Muffins,0,74.35,542.66,211.44
3,Paleo Chocolate Honey Bars recipes,0,77.32,349.38,266.18
3,DIY Chicken Burrito Bowl (Paleo),13,86.59,165.25,101.45
3,"Healthy Buffalo Turkey Meatloaf (Paleo, Whole30) recipes",0,217.07,34.17,134.74
3,Paleo Slow Cooker Beef Stew recipes,0,179.32,120.49,36.68
3,"Teriyaki Salmon Recipe (Grain-Free, Paleo) recipes",15,102.48,104.16,59.07
3,Banana Cocoa Snack Cake (Paleo) recipes,0,68.94,227.74,168.98
3,Paleo Creole Meatballs,0,134.14,55.22,177.0
3,Easy Paleo Shepherd's Pie recipes,0,107.14,93.45,137.29
3,"Buffalo Chicken Cobb Salad {paleo, whole30",0,3.26,7.35,89.83
3,Paleo Carrot & Apple Juicer Pulp Muffi,2,56.05,119.56,118.16
3,Sesame Ginger Paleo Turkey Meatballs recipes,0,104.28,42.67,56.99
3,"Coconut Chocolate Chip Healthy Vegan Ice Cream Recipe (Paleo, Homemade, Dairy-Free)",0,16.29,154.99,89.99
3,Zero Carb Beef Stew w/Paleo Rice By Paleo Nate,0,459.83,289.66,200.26
3,Creamy Paleo Chicken Enchiladas Verdes recipes,13,168.06,206.21,137.17
3,"Paleo Vegetarian Tacos with Zucchini, Squash & Eggplant recipes",13,33.3,254.57,86.36
3,Paleo Chocolate Pecan Tart,0,52.41,149.85,387.32
3,"Paleo Pepperoni Pizza with Veggies {GF, DF}",9,39.65,112.8,58.12
3,Chicken Shawarma on Pita recipes,14,237.66,213.88,158.28
3,Almond Crusted Tilapia,12,135.57,96.94,107.04
3,Paleo Creole Meatballs recipes,0,134.58,57.97,177.14
3,"Mini Zucchini Avocado Burgers Recipe [Paleo, Keto, AIP]",0,44.44,15.24,93.04
3,Paleo Thai Chicken Pizza recipes,17,69.42,349.98,61.24
3,"The BEST Strawberry Banana Bread {Paleo, Vegan, Gluten Free}",0,52.44,304.22,97.85
3,Paleo Albino Mole Cake – Maulwurftorte with a Twist,9,56.57,247.41,327.06
3,"Salted Caramel Paleo Bark (GF, dairy-free) recipes",0,29.64,509.13,144.51
3,Lemony Brussels Sprouts Salad {vegan+glutenfree+paleo},0,41.86,80.89,59.56
3,Paleo Clam Chowder with Cauliflower recipes,0,189.77,141.35,74.16
3,Paleo Asian Cauliflower Fried ‘Rice’ recipes,5,39.84,54.08,71.55
3,"Easy Apricot-Mustard Chicken Bake (paleo, GF) recipes",7,113.18,183.36,125.59
3,Paleo Mississippi Roast with Lotus Root recipes,2,163.04,58.41,164.26
3,New England Paleo Clam Chowder,0,334.83,207.38,333.75
3,Paleo Chicken Cauliflower Fried Rice,5,116.43,52.09,87.92
3,"My signature dish – Mediterranean Chicken, Paleo-ized",12,121.64,74.55,135.13
3,Red Robin Recreation – Perfectly Crispy Paleo French Fries recipes,7,18.84,183.47,311.62
3,Chorizo Breakfast Tacos recipes,13,68.47,66.7,85.65
3,Paleo Cashew Chocolate Chip Blondies recipes,0,63.76,267.66,229.85
3,Chocolate Chip Cookie Ice Cream Sandwiches ~ The Paleo Mom,0,23.05,281.18,165.66
3,Paleo Shepards Pie recipes,0,114.59,106.71,89.4
3,"Angel Food Cake (Grain-Free, Paleo) recipes",0,58.83,330.85,126.65
3,Paleo Chicken and Dumplings,9,377.65,125.61,194.55
3,Grain Free Ice Cream Sandwiches (Paleo and Low Carb) recipes,0,58.81,194.28,185.23
3,"Chocolate Berry Tart (Grain-Free, Paleo)",7,97.49,280.14,228.11
3,Paleo Chocolate Chunk Strawberry Banana Bread,0,38.2,228.92,94.83
3,Instant Pot Purple Paleo Potato Salad Recipe,12,49.16,188.97,182.14
3,Primal Guacamole Burger Recipe,13,99.33,50.03,102.87
3,"Paleo Kimchi Beef Stir-Fry (Whole30, Keto)",0,66.68,45.64,31.42
3,Baked FrenchFries with Chipotle Ranch Dip {Paleo & Whole30} recipes,13,17.83,143.96,192.82
3,"Vegan Paleo Blueberry Muffins {Grain Free, Gluten Free}",0,24.39,145.01,97.33
3,Guinness Stew recipes,7,173.53,188.85,75.26
3,"4 Ingredient Chocolate Peanut Butter Homemade Frosty Recipe (Vegan, Dairy-Free, Gluten-Free, Refined Sugar-Free)",0,25.63,137.31,38.5
3,Asian Healthy Broccoli Salad,5,61.72,116.82,136.47
3,Cilantro Base recipes,0,3.5,19.57,13.98
3,Paleo Slow Cooker Honey Garlic Chicken and Vegetables recipes,12,501.65,312.39,58.06
3,Paleo Italian Meatballs & Spaghetti Squash recipes,9,148.98,115.06,187.38
3,"30 Minute Beef Stroganoff Recipe (Paleo, Gluten Free, Dairy Free) recipes",6,110.57,36.4,308.95
3,"Squash Au Gratin (Paleo, GF) recipes",7,25.32,148.79,102.31
3,"Cream ""Cheesy"" Italian Stuffed Mushrooms {Paleo, Dairy Free, Whole 30}",9,175.1,129.3,475.09
3,Nightshade-free Pizza (from Make It Paleo 2) recipes,9,164.08,310.6,220.29
3,Paleo Turkey or Beef Meatloaf recipes,0,396.66,91.97,209.04
3,Slow Cooker Paleo Sweet Potato Casserole recipes,9,46.14,368.64,187.19
3,"French Swiss Chard Tart (Gluten-Free, Grain-Free, Vegetarian, Paleo Option) recipes",7,96.67,110.45,253.55
3,Paleo Brussels Sprout and Bacon Coleslaw recipes,4,44.13,80.3,340.69
3,Ranch Roasted Cashews recipes,0,51.65,88.86,137.28
3,Simple Egg Drop Soup recipes,5,88.59,102.88,60.78
3,Paleo Thanksgiving Stuffing with Pumpkin Bread recipes,0,33.75,350.04,119.19
3,Garlic Parmesan Zucchini Bread,9,47.68,72.73,92.86
3,Crock Pot Korean Gochujang Pork,7,409.4,101.9,415.15
3,"20 Minute Cashew Chicken Recipe {Paleo, Gluten-Free, Clean Eating, Dairy-Free} recipes",9,165.49,354.68,259.89
3,Paleo Kale Orange Beef Stir Fry with Spiralized Sweet Potato Noodles,1,53.5,90.16,45.21
3,"Bang Bang Shrimp (Paleo, Whole30, AIP)",10,94.91,24.03,95.1
3,"French Tomato, Tuna, & Mustard Quiche (paleo, GF) recipes",7,63.83,61.93,58.2
3,Bacon Wrapped Chili Dogs,0,73.79,27.35,199.7
3,"Coconut Custard Pie {Paleo, Dairy Free} recipes",0,80.9,762.78,525.09
3,"Lemony Spring Cobb Salad (paleo, GF) recipes",0,123.97,173.48,208.48
3,Mango Turkey Sloppy Joe Salad Bowls {Paleo} recipes,0,106.07,148.46,94.71
3,Zucchini-Bacon Egg Muffins (Gluten-Free),2,91.77,24.63,144.03
3,Easy Keto Low Carb Taco Soup Recipe,13,88.18,55.1,173.29
3,"Coffee Cake (Grain Free, Gaps, Paleo, Primal) recipes",0,109.97,342.18,267.62
3,Paleo Shrimp Cakes with Tangy Lemon Aioli recipes,12,76.25,59.59,119.56
3,Coronation Chicken Salad,0,106.52,38.99,136.13
3,Healthy Chocolate Potato Whiskey Cake with Chocolate Whiskey Ganache recipes,7,39.51,390.78,125.83
3,Seafood Pumpkin Spaghetti Squash Pasta {Paleo} recipes,9,37.87,78.72,76.18
3,"Sweet Potato Salad Niçoise (paleo, GF) recipes",7,119.06,196.4,78.45
3,"Sausage Tomato Basil Paleo Pizza {GF, DF} recipes",9,76.95,440.95,38.48
3,Crock Pot Barbecue Turkey Thighs recipes,0,401.69,121.06,139.12
3,"Red Coconut Curry Pulled Chicken (Paleo, GF) recipes",17,269.34,125.64,294.69
3,"Mixed Baby Greens with Strawberries, Gorgonzola and Poppy Seed Dressing recipes",12,18.06,64.11,53.22
3,Chocolate Dipped Chocolate Meringue Cookies recipes,7,21.57,53.33,61.7
3,Paleo German Chocolate Cake recipes,4,69.49,539.28,261.39
3,Paleo Pumpkin Chili {Nightshade-Free} recipes,0,160.42,229.01,71.05
