Diet_type,Recipe_name,Cuisine_type,Protein(g),Carbs(g),Fat(g)
0,Cajun BBQ Chicken,0,111.01,135.57,38.95
0,Slow-Cooked Venison,7,423.07,149.48,103.45
0,English Pea Salad,2,125.12,276.04,149.07
0,Pasta Salad with Tomatoes and Grilled Salmon,15,243.23,328.71,144.12
0,Ginger Tofu Stir-Fry,1,28.31,39.49,35.86
0,Mushroom Pie,2,75.84,112.14,194.46
0,Susan Feniger's Kaya Toast,17,39.43,241.45,95.03
0,Rustic Plum-and-Almond Tart,7,42.82,341.54,66.27
0,Pull-Apart Bread,0,81.82,1238.87,248.68
0,Caesar Salad with Baby Romaine,13,46.73,112.64,89.06
0,Homemade Ranch Dressing,0,6.43,12.16,201.69
0,Red berry fruit compote (German rote grütze),0,34.32,196.14,37.01
0,Herring and Apple Salad,2,98.93,44.22,52.24
0,Christmas chocolate yule log,15,81.29,787.82,525.49
0,Grilled Vegetable Sandwiches,12,50.31,199.05,81.23
0,Double Winter Delights,14,36.47,96.83,35.48
0,Tomatoey Shrimp and Polenta,9,61.31,99.14,15.23
0,Chop-Chop Beef Stir-Fry,5,34.66,25.15,22.12
0,Buche De Noel,7,52.37,530.77,137.42
0,Grilled Snapper with Red Pepper Sauce,16,120.65,20.65,35.72
0,Broad bean and runner bean risotto,9,65.08,314.49,102.18
0,Snapper Piccata,9,120.02,11.85,33.02
0,Grilled Apples with Herbes de Provence and Micro Greens,0,7.74,93.4,77.17
0,Italian Seafood Salad (Insalata di Mare) Recipe,9,272.1,82.36,264.57
0,Chinese Braised Shrimp E-Fu Noodles (伊麵 - Yee Mein),1,62.17,256.65,18.66
0,Chicken Fajita Bar Party!,0,366.0,68.53,154.22
0,Ultra Moist Carrot Cake recipes,0,76.66,904.06,327.66
0,Creole Red Snapper,0,143.96,23.58,23.81
0,Hachis Parmentier,7,28.24,129.69,44.58
0,A Little Fruit with My Crisp,0,60.88,628.45,274.77
0,Smoked Fish & Cherry Tomato Rarebit,9,232.28,126.99,163.44
0,'Dragon prawn' noodles,1,165.01,267.89,49.48
0,Instant Pot Adobo Chicken Thighs with Bok Choy & Green Onions,5,119.35,41.79,66.65
0,"Zucchini, Kale And Onion Quiche",7,61.82,184.89,137.5
0,Christmas Sugar Wafers with Vanilla Icing,0,27.16,386.56,54.21
0,Demon Pork,0,93.98,0.22,49.97
0,English Pea Salad recipes,2,125.12,276.04,149.07
0,Savory Stuffed Acorn Squash,0,55.43,211.39,22.19
0,Roasted Sicilian Potatoes,9,23.73,222.52,57.55
0,Happy Birthday Pancakes Recipe,7,19.52,88.59,74.39
0,CINNAMON ROLLS with COCONUT FROSTING & CARAMEL RAISIN FILLING recipes,0,50.73,649.31,66.02
0,Un-Fried Chicken,0,283.53,198.39,384.62
0,Skillet-Roasted Citrus Salmon with Grilled Vegetables,15,123.83,75.03,104.1
0,Chinois Grilled Lamb Chops,5,220.84,68.4,689.02
0,Salmon Mousse,15,1239.47,22.4,983.36
0,Sunny's Warm German Potato Salad,4,42.93,127.64,93.71
0,Gordon Ramsay's Christmas Pudding,2,80.69,922.26,264.56
0,"Penne With Chicken, Chorizo And Chile",12,172.16,341.05,161.09
0,Squash Casserole from 'Mastering the Art of Southern Cooking',0,132.65,235.16,463.56
0,Fresh Cheese And Cilantro Dip,12,17.26,22.3,16.45
0,Peppermint Patty Sheet Cake,0,49.45,1066.72,200.63
0,Tuna Burgers With Lemon Paprika Aioli,12,67.16,57.33,110.11
0,Potato Gateau,12,176.76,224.46,221.7
0,Gazpacho,9,13.19,63.67,58.29
0,Arugula Salad with Chicken and Apricots,12,83.16,36.04,59.89
0,Seared Spiced Tuna With Zucchini,9,62.56,27.81,57.81
0,French style lemon yogurt cake with fresh basil,7,49.82,357.35,163.89
0,Turkey Burger Pitas with Tahini Sauce,0,113.57,70.03,62.69
0,Mediterranean Pita Melts,12,46.57,139.71,37.7
0,Deep Dark Chocolate Layer Cake,0,68.46,1027.98,177.08
0,Healthy & Delicious: Italian Egg-Drop Soup Recipe,9,113.9,193.71,47.54
0,Warm Brownie Pudding Slow-Cooker Dessert,7,40.09,538.92,71.08
0,Beautiful Lamb Shanks,14,370.1,154.13,307.04
0,Bacon And Tomato Salad,0,57.16,70.62,281.46
0,Easy Caramel Apple upside-down cake,0,65.34,710.83,190.01
0,Black Bean Burgers,0,77.08,309.03,45.43
0,"Spinach, Green Onion, and Smoked Gouda Quiche",7,70.65,141.46,129.23
0,Crab Cakes Chiarello with Shaved Fennel Salad,9,193.07,116.06,500.84
0,Creamy Cabbage Soup with Chive Oil and Cumin Seeds,6,21.88,66.11,133.42
0,Cherry Tomato and Watermelon Salad,16,11.14,70.22,58.18
0,Pasta e Fagioli,9,139.39,321.44,87.42
0,Fresh Tomato Sandwiches,9,39.91,63.19,37.71
0,Winter Fruit Compote with Selection of Cheese,6,19.85,411.72,19.35
0,Baked French Toast Casserole with Maple Syrup,0,128.81,541.41,374.69
0,The Ultimate Rosemary BLT recipes,0,167.72,603.67,318.46
0,The Michelada,18,4.01,31.24,0.14
0,Artichoke Fritters,12,44.63,174.64,69.66
0,Sticky Date and Coconut Cake,0,32.29,667.58,96.44
0,Indian Spiced Swiss Chard,8,25.08,80.76,4.99
0,Cranberry Salsa recipes,0,1.58,86.84,0.52
0,Fried Onion Dip,0,11.26,45.62,100.02
0,Buffalo Chicken Salad,0,78.28,20.3,148.43
0,Amish Pumpkin Cinnamon Rolls with Caramel Icing recipes,0,56.31,494.69,107.09
0,Cranberry-orange cloud ice cream,0,20.8,366.9,56.27
0,Garlic and Herb Roast Pork and Vegetables,12,235.78,156.25,140.79
0,Pecan and Cranberry Crusted Salmon with Cran-Apple Drizzle,0,149.3,216.12,170.76
0,Dad's Chorizo and Egg Breakfast Tacos,12,50.96,127.37,83.64
0,Sweet Potato and Poblano Salad with Honey and Rosemary,16,21.2,276.24,74.68
0,"Spicy, Creamy Chickpeas & Spinach (Chana Saag-ish)",8,83.76,238.44,118.21
0,Tomato Bon Bons,0,187.36,261.5,1180.89
0,Lasagne that used to be Manicotti,9,487.56,618.19,466.13
0,The Perfect Potato Chip,0,40.71,281.17,25.54
0,Cobb Salad recipes,0,290.17,147.07,594.46
0,Quinoa Pilau,16,26.28,126.28,51.7
0,Vegetable Sushi with Asian Dipping Sauce,10,21.74,101.81,74.18
0,Old Bay Green Bean Casserole with Crab Recipe,0,81.74,160.38,91.31
0,Sour Cream Mushroom Soup,0,63.73,116.71,45.05
0,Potato Gnocchi with Lemon-Thyme Sauce,12,25.61,159.87,88.42
0,Roasted Oysters with Lemon-Anise Stuffing,12,80.02,81.98,34.97
0,Das Pear Pineapple Strudel,0,7.0,104.57,83.1
0,Berrylicious Sour Cream Pie,0,26.11,448.18,89.37
0,Spiced Jerk Turkey with Mango Salsa,0,51.49,19.44,30.32
0,Baked French Toast Casserole,7,129.12,543.33,398.98
0,Recipe: Braised Coconut Spinach & Chickpeas with Lemon,0,57.94,161.09,108.55
0,Turkey Pot-au-Feu,0,110.82,63.85,36.56
0,Individual Spinach-Asiago Gratins,7,31.99,56.85,23.33
0,Carrot Cake Whoopie Pies with Cinnamon Cream Cheese Frosting,0,59.66,719.77,202.56
0,"Canoas (Ripe Plantain ""Canoes"" Stuffed with Ground Meat)",16,90.42,470.78,110.69
0,Miso and Corn Soup,10,102.07,176.96,79.36
0,Rioja-braised lamb shanks with chorizo and garlic,12,390.93,121.0,685.39
0,Avocado and Corn Tostaditas,13,23.18,112.72,53.92
0,Chicken & Mushroom Ragout,12,100.23,19.18,73.81
0,Cantaloupe & Green Tomato Salad,7,7.87,59.6,9.8
0,My killer guacamole,13,16.3,83.63,100.66
0,Apple Turnovers recipes,7,39.2,323.65,191.08
0,New York Strip Steaks,0,155.77,210.05,203.06
0,Mushy Peas With Oven Baked Chips,0,25.94,127.29,15.6
0,Double-Chocolate Soufflé with Vanilla Custard Sauce,7,61.74,291.87,58.58
0,Buttered-Pecan French Toast with Bourbon Maple Syrup,0,82.66,445.96,259.08
0,Chicken Salad Crostini with Pepitas and Cilantro,0,99.16,171.5,275.33
0,Crunchy Quinoa Salad,16,33.82,137.61,11.39
0,Ramos Gin Fizz,18,4.93,10.77,18.54
0,Grilled Butterflied Lamb with African Spices and Herbed Yogurt,0,326.72,27.72,299.81
0,Pat's Smoked Catfish,0,164.38,72.04,121.89
0,Pumpkin Sheet Cake recipes,0,63.05,1102.87,367.85
0,Seelbach,18,0.19,6.63,0.0
0,BALSAMIC GLAZED FIGS w/PANCETTA & MASCARPONE,0,21.73,268.42,48.52
0,Cold Noodle Salad With Peanut Butter Dressing,1,70.51,210.97,237.98
0,Vegetarian Beyond Meat Juicy Lucy Burger,0,85.94,34.23,43.45
0,Mexican Stuffed Acorn Squash,13,89.45,176.5,101.1
0,Asian Vegetable Noodle Toss,1,77.6,250.83,13.97
0,Dr. Zhivago Borscht,0,17.55,133.73,34.56
0,Cook the Book: Barbecued Lentils,8,30.82,125.45,15.07
0,Caesar Bread Salad Or Panzanella Giulio,0,98.97,303.62,180.76
0,the most delicious chinese chicken salad,5,160.68,40.78,428.75
0,Roasted Pepper Pesto Cheesecake,9,163.66,382.56,289.6
0,Pasta e Fagioli,9,63.84,191.71,21.73
0,Wedge Salad with Parmesan-Peppercorn Ranch,0,56.5,185.26,225.97
0,Low Carb Praline Pumpkin Pie,0,43.14,93.16,275.08
0,Chicken Stir-Fry Lettuce Wraps,5,112.82,59.38,56.02
0,Atf Gingerbread Cake With Gingery Cream Cheese Frosting,0,43.7,834.47,175.62
0,Kentucky Chocolate Nut Tartlets,0,16.77,242.78,56.69
0,Quinoa Blueberry Muffins,0,68.27,413.95,90.63
0,Pear Crisp with Oat Streusel Topping,7,45.12,509.29,83.29
0,Duo of New England and Manhattan Clam Chowders,0,130.22,279.43,65.2
0,"Lamb tajine with apricots, saffron and ginger",14,213.18,224.76,312.84
0,"Potato Salad With Watercress, Cucumber And Radish",12,16.38,105.19,50.35
0,Spiked cranberry nut bread pudding,2,66.76,302.61,185.07
0,Sweet Potato And Beet Fritters With Herbed Buttermilk Dip recipes,16,39.19,149.9,76.25
0,'Bella Asada Fajitas,13,12.39,85.11,14.77
0,A Charoset-inspired sweet relish,7,10.42,80.79,28.06
0,Chocolate Cupcakes with Vanilla Cream Cheese Frosting,0,49.88,577.51,142.08
0,Slow-Cooker Carrot Cake With Cream Cheese Frosting,0,33.42,286.1,144.75
0,Poached Eggs with Chipotle Dressing and Avocado Relish and Andouille Hollandaise,0,101.69,211.33,845.81
0,Turkey-Stuffed Mushrooms with Roasted Tomato Aioli,0,36.12,29.26,29.06
0,Cranberry-Apple French Toast Casserole,0,104.28,514.44,118.58
0,Caesar Salad,0,39.59,98.24,178.79
0,Chocolate And Peanut Butter Ice Cream Sandwiches recipes,0,108.02,614.91,525.87
0,Chicken Pastilla,12,205.32,191.6,203.38
0,Simple Butternut Squash,16,11.86,85.54,14.96
0,Apple Inception Cocktail,18,0.23,7.09,0.1
0,Artichokes alla Romana,12,32.8,150.19,3.86
0,"Spinach Salad with Bacon, Blue Cheese, Pecans, and Cranberries",0,76.1,181.73,222.42
0,"Mixed Greens with Jicama, Orange, and Pickled Red Onions",0,20.13,122.65,161.22
0,Spicy Pickle Fries with Homemade Ranch Dip,16,36.86,154.88,54.84
0,Seelbach Cocktail,18,0.13,10.32,0.07
0,Crawfish Beignets with Spicy Remoulade,0,40.9,238.4,203.47
0,Chocolate-Almond Cheesecake Bars,0,75.36,299.24,164.61
0,"Crostini with Gorgonzola, Caramelized Onions, and Fig Jam",9,64.82,265.84,57.67
0,Grilled Chicken and Egg Potato Salad,16,205.37,139.85,110.64
0,Cashew Chicken Bake,16,149.18,173.27,113.57
0,Texas Caviar,0,48.42,178.41,46.04
0,Crispy White Fish + Sweet Potato & Beet Curly Fries,7,118.58,117.11,67.47
0,"Pasta with Lemon Cream Sauce, Asparagus, and Peas",9,44.91,213.35,45.4
0,Peppermint Patty Cake with Vanilla Mint Frosting recipes,0,52.51,1212.98,571.51
0,Rum Old Fashioned recipes,2,0.35,284.46,0.0
0,Black Bottom Banana-Cream Pie,0,45.4,294.66,73.43
0,Italian Wedding Soup,9,154.59,166.97,138.85
0,Young Corn And Celery Soup,16,44.54,162.83,58.11
0,Crisp Crab Cakes,0,113.3,55.98,56.34
0,Spinach Stuffed Spicy Panko Crusted Pork Chops with Creamy Rustic Pan Sauce,0,139.32,118.24,111.07
0,"Tagliata With Green Tomatoes, Oregano And Mustard Recipe",7,106.35,55.28,151.0
0,Strawberry Shortcake Cake,2,60.15,1218.48,404.79
0,Green Chile Tortilla Bake,13,196.16,486.11,289.14
0,Crab Cake Poppers,0,107.96,73.39,280.89
0,Potato-Zucchini Skillet Pancakes with Cherry Tomato Salad,0,20.1,199.24,26.91
0,Vermouth Cocktail Recipe,18,0.13,3.87,0.02
0,A&O Pasta (Almonds & Oysters Pasta),9,77.66,256.82,169.44
0,Red-Braised Pork (Hong Shao Rou),5,79.05,67.02,340.88
0,Apple Crostata with Oat Crumble Topping,7,47.82,676.38,178.16
0,Mississippi Mud Pie,0,46.55,437.23,114.57
0,Queens Park Swizzle Recipe,18,0.23,18.61,0.06
0,Chocolate-Zucchini Loaf Cake,0,50.92,441.54,144.43
0,Sazerac,18,1.06,7.23,0.95
0,Salmon & Puy lentil salad with olive dressing,15,193.4,362.68,124.98
0,Capellini Primavera,9,98.3,490.73,107.99
0,The Jameson Black Barrel Old Fashioned,18,0.23,14.99,0.14
0,"Gin and Tonic, Remixed",18,2.96,30.28,0.56
0,Pumpkin-Sweet Potato Soup,16,15.75,107.52,75.15
0,Roast Chicken with Boiled Potatoes and Boston Lettuce Salad,17,384.37,505.28,156.57
0,Baked Pita Chips with Charred Three Onion Dip,12,63.59,252.6,237.73
0,Toasted-Coconut Layer Cake,0,56.64,922.88,203.66
0,Amazing Apple Tart,0,13.39,175.6,55.28
0,Mozzarella in Carrozza with Sun-Dried Tomato and Roasted Red Pepper Jam,9,58.61,232.13,93.34
0,Curry Potato Salad,8,34.92,205.47,119.76
0,"Chicken Curry with Bananas, Raisins, and Peanuts recipes",17,114.85,122.56,157.97
0,Bonnie’s Fish Stew,7,400.08,147.52,155.6
0,Cucumber Gazpacho with Shrimp Relish,0,79.47,53.8,31.92
0,Har Gow,5,73.27,143.16,38.56
0,"Halibut with Grapefruit, Parsley, Red Onion, and Shiitake Mushrooms recipes",0,137.2,67.4,323.06
0,Coffee Seafood Risotto,9,72.08,210.69,86.22
0,Salsa,13,10.75,50.01,4.15
0,Ground Beef Tacos with a Zesty Guacamole,13,154.56,209.25,265.7
0,Chocolate Covered Pears Poached in Mulled Wine,0,11.36,255.41,122.76
0,"Broccoli, Cheddar, and Ranch Chicken Calzones",9,83.38,16.85,102.3
0,Sara's Famous Sausage-Apple Gravy,0,98.23,96.41,184.67
0,Summer Tomato and Bell Pepper Soup,9,30.35,42.33,69.84
0,Almond-Thyme-Crusted Mahi Mahi with Lemon Chardonnay Sauce,12,33.78,27.43,28.67
0,Flank Steak with Tomatillo Salsa Verde,16,136.79,185.81,272.5
0,Taco Night,13,144.61,324.37,175.17
0,Coconut-Panko Shrimp With Orange-Glazed Sweet Potatoes,12,120.75,271.21,104.41
0,Fully-Loaded Cheesy Potato Soup with Gina's Spinach Salad,0,182.49,306.34,403.79
0,Squash Cheese Pie,0,112.04,79.92,118.34
0,Buffalo Chicken Sandwiches & Ranch,0,186.08,186.44,227.67
0,Strawberry And White Chocolate Passion Fruit Soups With Mixed Berry Muffins,0,86.53,606.03,390.41
0,Red Snapper Cocktail Recipe,18,1.64,8.71,0.61
0,Neely's Fish and Chips,2,215.31,470.7,621.31
0,Salmon & Crab Cakes,15,93.88,85.94,63.4
0,Maple Leaf Sazerac From Minetta Tavern,18,0.02,17.27,0.02
0,Triple cheese & aubergine lasagne,9,201.57,460.02,245.9
0,Squash & Sprout Orzo Salad With Ginger-Walnut Dressing,12,133.61,684.05,107.04
0,Man About Town,7,0.02,0.77,0.0
0,Family-Style Taco Night,13,226.45,173.83,190.15
0,Shrimp Cakes with Peach Jalapeno Relish,11,136.68,184.84,51.69
0,Potstickers with Spicy Dipping Sauce,5,111.69,463.15,85.39
0,Turkey Tetrazzini,0,78.39,131.57,21.1
0,Neely's Fried Zucchini,9,64.97,168.72,322.27
0,Salmon & Puy Lentil Salad With Olive Dressing,15,188.3,362.68,121.63
0,Bloody Mary,7,1.71,10.42,0.56
0,Thai Turkey Salad,17,67.43,50.79,79.95
0,Cardamom Blush Cocktail Recipe,18,0.11,23.24,0.07
0,Cobb Salad with Blue Cheese Dressing,0,290.22,160.03,596.29
0,Seafood Salad with Creamy Ginger Dressing,12,111.64,68.46,21.8
0,Zucchini Cheddar Hand Pies recipes,2,74.82,285.55,220.66
0,Crab Benedict,7,81.76,17.94,197.57
0,Southwestern Steak Pizza,9,95.55,137.54,116.04
0,L’Artusi’s Famous Mushroom Ragu With Fresh Garganelli,9,162.0,550.0,254.34
0,Gazpacho,12,32.28,118.15,127.5
0,Fresh Macaroni Salad,0,34.47,94.43,29.91
0,Orange-Hazelnut Dacquoise,9,65.0,445.9,190.77
0,Joanie's Moules Ravigote,7,116.41,78.57,134.81
0,Vegetarian Banh Mi,17,99.62,305.36,266.51
0,Carrot Cake Gelly Shots,2,31.96,155.41,22.11
0,Lentil-Red Pepper Salad,16,42.98,129.67,3.98
0,My children love beet salad!,0,20.11,92.55,50.04
0,"Farro, Golden Beet, and Feta Salad with Pecans and Chive-Sage Dressing",12,40.66,186.3,111.8
0,Off the Cuff Turmeric Risotto,9,50.28,319.5,14.67
0,Berry-Mandarin Tossed Salad,7,34.25,196.26,140.0
0,Spaghetti & Meatballs,9,154.9,167.71,105.1
0,Mushroom and Bell Pepper Chicken with Linguine,9,222.08,290.21,110.97
0,Cardamom Blush Cocktail recipes,18,0.11,23.24,0.07
0,Suzhou-Style Mooncakes,9,93.64,288.31,151.0
0,Braised Coconut Spinach with Chickpeas and Lemon Recipe,7,63.68,218.05,109.19
0,Baked French Toast Casserole,7,130.39,774.89,403.71
0,Grilled Vegetable Sandwiches,12,51.19,205.38,82.67
0,Homemade ranch with iceberg wedge,0,15.77,43.1,205.37
0,Gougères recipes,7,219.81,200.28,302.05
0,Hungarian Sour Cherry Soup (Meggyleves),18,27.96,180.99,120.39
0,Summer Melon Salad,9,20.76,50.15,44.85
0,Old-Fashioned Caramel Layer Cake,0,61.21,1019.34,105.84
0,Caesar Salad With Red Romaine,0,92.98,117.64,161.31
0,Orange Sweet Rolls,0,85.62,1314.61,276.55
0,Chicken with Green Olives,12,183.41,432.21,140.98
0,Curried Squash Soup,8,37.22,144.41,69.73
0,Chicken & Cornmeal Dumplings,0,86.0,105.24,80.77
0,Asian Stir Fried String Beans with Pork,17,49.65,47.34,78.72
0,Zombie Punch Recipe,18,0.25,89.85,0.06
0,Raw Veggies with Chipotle Ranch Dressing,0,32.63,217.23,207.25
0,Mini Black Jack Burgers,0,190.75,205.38,158.75
0,Time for a Drink: Bloody Mary Recipe,18,1.03,5.12,0.37
0,Caesar Salad Le Cirque recipes,0,96.12,98.43,353.39
0,Preserved Lime Tabbouleh Salad,14,50.82,235.1,57.13
0,Quick-Marinated Cherry Tomato Salad recipes,7,242.97,618.82,571.91
0,Broiled Marinated Skirt Steak with Cilantro and Preserved Lemon Gremolata,0,92.32,12.71,65.46
0,Pumpkin Polenta Recipe With Tomatillo-Avocado Salsa,16,25.55,215.41,94.48
0,"Chicken, Spring Pea and Farro Risotto with Lemon",9,77.06,66.69,32.36
0,3-Bean Chili,0,114.28,422.73,65.73
0,"Sweet Potato, Orange and Ginger Cream Soup with Crispy Sweet Potatoes and Chilli Flakes",0,40.58,294.06,77.81
0,Plum Galette With A Whole-Wheat Crust,7,31.79,313.9,101.44
0,Shrimpylicious Egg Rolls,5,41.58,173.55,77.57
0,Cheesecake Factory's Fresh Banana Cream Cheesecake recipes,0,120.61,762.65,686.38
0,Garlic Chicken Lasagna,9,316.09,434.39,311.08
0,Cockerel in Riesling Mushroom Sauce with Ribbon Noodles,1,256.12,196.68,656.17
0,Pepper Confetti Macaroni and Cheese,12,102.48,341.31,64.1
0,Corn and Crab Cakes,0,68.03,89.88,110.77
0,Melty Chocolate-Stuffed French Toast with Lemon-Orange Syrup,7,105.45,422.23,98.8
0,Potato-Butternut Gratin With Poblano Béchamel,7,74.93,191.52,90.82
0,Italian Tomato Tart,9,70.67,300.07,63.38
0,Arugula Salad with Shrimp and Grapes,0,59.82,74.45,23.0
0,Myrtle's Meatball Recipe,0,230.47,120.48,108.19
0,Crab Cakes,0,105.56,79.67,46.01
0,Buffalo Shrimp Salad with Spicy Pita Croutons,9,23.61,44.49,29.27
0,Bean Cabbage Soup,14,21.49,58.32,8.68
0,"Polenta With Winter Salad, Poached Egg, and Blue Cheese From 'Feast'",0,62.66,135.6,128.75
0,Fall Lasagna with Pumpkin and Italian Sausage,9,163.02,270.26,336.19
0,Chicken Taco Salad,13,111.69,182.51,124.41
0,Fireside Fajitas,13,149.74,251.38,58.06
0,Chocolate Raspberry Tart with White Chocolate Cream,0,50.95,337.64,101.7
0,Mita Mary,18,2.09,15.26,4.68
0,"Harvest pie with swiss chard, cheese, orange zest and fennel",0,289.73,1088.52,263.99
0,Classic Lasagna,9,345.28,521.73,260.35
0,Parchment-Roasted Cornish Game Hens with Maple Root Vegetables,0,248.55,275.74,282.54
0,Time for a Drink: Cocktail à la Louisiane Recipe,18,0.04,7.45,0.06
0,Improved Negroni,0,3.51,56.44,0.72
0,Loaded Nachos,13,145.11,165.79,212.25
0,Lemon Asparagus Penne,9,94.29,269.41,81.81
0,"Saffron Couscous with Roast Autumn Vegetables, Pecans, Cranberries and Figs",0,54.88,301.31,134.71
0,City of Lights Salad Nicoise,7,125.33,208.46,112.92
0,Braised Pork Belly Sandwich with Pesto Mayo,9,196.72,279.07,713.11
0,Spicy Vegetable Bake,0,80.5,154.94,117.4
0,Pluot Galettes with Apple Mint and Calvados-Laced Whipped Cream,7,56.7,634.09,258.15
0,Denis Leary's Zesty Baked Chicken Wings,0,160.74,149.65,152.85
0,Seelbach Cocktail Recipe,18,0.1,3.71,0.0
0,Improved Scotch Cocktail Recipe,18,0.0,3.73,0.01
0,Spicy Chicken and Butternut Squash Tortilla Soup,13,168.64,192.95,179.09
0,Song of Songs Cocktail,0,0.0,17.47,0.01
0,Jazzed Up Turkey Tetrazzini,0,517.47,575.58,377.75
0,Manhattan Cocktail Recipe,18,0.02,0.83,0.0
0,Ratatouille Galette,7,63.51,229.84,157.88
0,Tropical Gingerbread Cake,0,58.73,700.8,138.0
0,Southern Grits And Greens Casserole,0,79.85,166.58,135.26
0,Serious Salsa: (Not Exactly) My Uncle's Salsa Recipe,0,4.31,21.54,2.68
0,"Marinated zucchini noodles with tomato basil sauce, dried baby tomatoes + garlic portobello meatless balls",1,13.92,85.7,19.91
0,Big Mama's Nacho Dip,0,135.46,118.26,161.92
0,Dumplings: those little Humpty-Dumptys,5,111.1,457.42,92.58
0,Class Act,18,1.63,7.6,0.04
0,Crafty Crescent Lasagna,9,202.59,298.24,188.17
0,Homemade Turkey Alphabet Soup,0,1190.35,49.13,297.45
0,Lighter Beef Stroganoff,6,112.22,82.68,101.61
0,Sweet Chile Pork over Cumin Beans and Cilantro Rice,13,407.45,881.0,145.87
0,The Ultimate Ketel One Blood Mary,18,1.35,9.04,0.41
0,Marinated Portobello Stuffed Whole Chicken with Roasted Sweet Potatoes and Red Onion,0,187.41,123.19,389.06
0,"Broiled Fish with Maple Glaze, Braised Fennel, and Sautéed Chard Recipe",0,66.0,75.9,40.88
0,Shrimp Bisque,12,95.65,85.82,28.44
0,Fresh Tomato Bloody Mary with Garden Herbs and Celery Bitters recipes,7,8.38,38.04,2.26
0,"Beets, Tahini, Flatbread + Lentils",12,98.37,354.82,75.16
0,asian ginger & soy coleslaw salad,5,34.06,170.14,176.45
0,Pumpkin Chutney,8,14.38,349.29,30.28
0,The Outcider from Prime Meats Recipe,18,2.13,58.24,0.7
0,In A Jiffy Spelt Veggie Burgers recipes,0,41.05,169.73,16.48
0,Best Ever Turkey Chili,0,135.54,135.43,67.71
0,Caesar Salad Le Cirque Recipe,0,96.11,98.41,353.39
0,Lillet of the Valley Recipe,18,0.42,14.98,0.15
0,Cinnamon Rolls,15,163.98,2450.17,709.82
0,Crab Cakes,0,105.82,81.28,46.09
0,Southern BBQ Pork Bowls,0,361.44,143.36,280.07
0,Pork Stew,2,250.91,128.52,216.81
0,Shrimp Hushpuppies with Vidalia Onion Dip,0,111.36,286.42,549.88
0,Potato Spinach Sausage Casserole,9,93.44,164.59,165.22
0,Caesar Salad,0,61.36,94.97,126.22
0,New England Fish Chowder,0,209.48,117.08,163.87
0,"Old-Fashioned Fans, Meet The American Trilogy recipes",18,0.0,4.26,0.0
0,Lean Lasagna,9,194.53,435.09,78.18
0,Classic Hot Wings,0,152.04,8.53,312.86
0,Pumpkin Cheesecake With Bourbon-Spiked Cream,0,143.68,698.64,727.58
0,Pumpkin Gingersnap Cheesecake with Salted Caramel Sauce,0,93.08,887.87,519.63
0,Cognac Sparklers recipes,18,0.25,28.02,0.32
0,Fish Chowder,0,209.48,117.08,163.87
0,Smoked Pork Ribs,0,413.24,73.34,609.09
0,"Grilled Salmon & Cucumber, Fresh Herb & Feta Salad",12,157.58,50.82,149.36
0,Grilled Chicken Banh-Mi with Pickled Vegetables and Sriracha Mayo,10,118.37,215.29,102.24
0,Meatball Stroganoff,6,113.71,186.13,108.46
0,Mango and Quinoa Chopped Salad with Ancho-Mango Dressing,16,75.39,362.92,18.19
0,Spinach & Feta Squash Quiche,12,53.45,54.58,61.72
0,Pomegranate Americano Recipe,7,0.09,7.44,0.16
0,Fresh Ginger Cake with Candied Citrus Glaze,0,65.37,787.82,181.09
0,Bloody Mary recipes,18,1.2,6.82,0.43
0,Pimento Cheese Sandwiches,0,137.16,27.73,516.8
0,Black Bean and Mushroom Vegetarian Meatless Balls,7,94.86,274.81,39.33
0,Manhattan,18,0.03,2.95,0.01
0,Neelys Egg Benedict on a Pork Croquette,9,165.34,209.29,431.44
0,No Man's Land,18,0.05,15.26,0.03
0,Brown Butter-Sunchoke Soup With Brussels Sprouts and Bacon Recipe,9,85.2,288.14,137.15
0,Make-Your-Own-Salad,0,141.98,123.18,323.5
0,Luis Buñuel Dry Martini,18,0.01,0.39,0.0
0,Cornflake Semi-Fried Chicken Tenders,0,155.38,239.88,260.84
0,Emeril's Classic Manhattan,0,0.02,0.83,0.0
0,Mango and Quinoa Chopped Salad with Ancho-Mango Dressing,16,75.39,362.92,18.19
0,Spinach & Feta Squash Quiche,12,53.45,54.58,61.72
0,Pomegranate Americano Recipe,7,0.09,7.44,0.16
0,Fresh Ginger Cake with Candied Citrus Glaze,0,65.37,787.82,181.09
0,Bloody Mary recipes,18,1.2,6.82,0.43
0,Pimento Cheese Sandwiches,0,137.16,27.73,516.8
0,Black Bean and Mushroom Vegetarian Meatless Balls,7,94.86,274.81,39.33
0,Manhattan,18,0.03,2.95,0.01
0,Neelys Egg Benedict on a Pork Croquette,9,165.34,209.29,431.44
0,No Man's Land,18,0.05,15.26,0.03
0,Brown Butter-Sunchoke Soup With Brussels Sprouts and Bacon Recipe,9,85.2,288.14,137.15
0,Make-Your-Own-Salad,0,141.98,123.18,323.5
0,Luis Buñuel Dry Martini,18,0.01,0.39,0.0
0,Cornflake Semi-Fried Chicken Tenders,0,155.38,239.88,260.84
0,Emeril's Classic Manhattan,0,0.02,0.83,0.0
0,100-Mile Dash,0,1.9,236.76,1.02
0,Goulash In A Dash,7,137.31,120.32,35.92
0,Garlicky Wilted Kale (with a dash of Nutmeg),0,29.41,75.78,47.8
0,Modern Cocktail No. 2 Recipe,18,0.06,18.81,0.17
0,Three Dots And A Dash,0,0.51,139.67,0.0
0,Brooklyn Cocktail recipes,18,0.02,1.06,0.0
0,Pegu,18,0.12,10.92,0.1
0,Aztec Chocolate Bark,0,34.28,227.68,134.18
0,Celery Cider,12,0.07,7.07,0.08
0,Spaghetti Squash with Maple Syrup and Shallots recipes,0,8.54,128.66,39.43
0,Emeril's Sazerac,18,0.09,5.2,0.02
0,Al's Bloody Best,18,1.0,4.81,0.35
0,My Favorite Bloody Mary,18,0.81,4.85,0.26
0,The Fourth Regiment Cocktail recipes,18,0.11,1.76,0.02
0,Vieux Carré Recipe,18,0.02,1.53,0.01
0,The Berkeley Free Speech Cocktail,18,0.08,11.69,0.04
0,Sazerac,18,0.0,4.87,0.0
0,H-O-T Hot Boneless Buffalo Wings,0,274.74,32.48,228.5
0,Garbo Gargle Cocktail recipes,18,0.06,6.05,0.02
0,Pinnacleandreg; Sunday Funday,18,4.34,19.35,0.99
0,The Red Snapper from the King Cole Bar recipes,18,0.56,2.84,0.25
0,3 Delicious Ways To Roast Your Cauliflower recipes,0,2.85,15.5,1.13
0,Lemon-Basil Risotto with Tomato Topping,9,2.28,11.32,7.3
0,Green Beans with Shallots,2,22.61,103.61,15.74
0,The Cool Cucumber,18,0.41,4.71,0.09
0,Asparagus with Warm Vinaigrette,7,10.38,31.92,0.63
0,Agave Lime Chicken recipes,0,150.85,124.57,144.13
0,The Ginger Side,18,0.03,5.49,0.0
0,Cuba Libre,18,0.18,9.9,0.05
0,Spiced Old Fashioned,0,0.25,9.07,0.15
0,Agave Lime Chicken,0,228.97,115.98,222.1
0,Love In Jalisco,18,0.05,5.45,0.05
0,Biriyani,8,284.38,496.15,245.96
0,Pomegranate Chicken with Preserved Lemon and Almond Rice Pilaf Recipe,12,280.03,290.25,277.65
0,Pecan Butter,0,18.36,47.61,162.93
0,La Paloma,18,0.23,3.59,0.07
0,Bonus Recipe: Do the Cabbage Pack!,0,10.9,35.69,34.85
0,Michelada,18,2.12,19.87,0.14
0,I Love Ny Veggie Pizza,9,51.86,169.4,30.88
0,The Ginger Side,18,0.03,5.49,0.0
0,Baked Cheese Spread,0,66.25,36.82,440.83
0,Healthy Whiskey & Ginger,18,0.11,6.38,0.04
0,Maple-Gingerbread Pots de Crème,0,34.51,152.25,85.14
0,Bloody Mary,18,1.08,5.44,0.36
0,Easy Pot Roast,15,492.51,78.8,153.25
0,"Garganelli Pasta with Scallops, Tomatoes and Green Beans",9,65.15,303.67,36.05
0,Bourbon Old Fashioned Recipe,2,0.0,10.42,0.0
0,Jalapeño-Spiked Cherry Preserves,0,7.28,593.23,2.23
0,"Potato, Leek and Parmesan Cheese Dumplings",5,219.19,653.27,99.29
0,Old-Fashioned Cornbread Stuffing,0,62.04,264.05,147.9
0,Mezcal Paloma,18,0.06,1.25,0.01
0,Avocado-Sprout Toast,0,5.54,17.37,9.62
0,Pepperoni Pizza Wrap,9,50.91,31.1,84.27
0,"Peaches With Creme Fraiche, Brown Sugar, Cinnamon And Nutmeg",7,1.51,19.1,3.2
0,Men Are From Mars,18,0.27,10.65,0.1
0,Crunchy Baked Fish,0,131.61,14.66,21.66
0,Simple Savory Scallops,0,3.03,0.92,0.14
0,Karthago Cocktail,18,0.46,4.56,0.15
0,Pink Pasta,9,72.88,388.59,124.26
0,Candy Corn Milkshake,0,20.41,105.95,44.92
